,id,sentence,subject_entity,object_entity,label,annotator,pair,label_,label_num
307,한반도_61,석회암의 용식지형인 카르스트 지형은 석회암지대가 분포하는 강원과 충북 일대에 발달하였다.,"{'word': '충북', 'start_idx': 36, 'end_idx': 37, 'entity_type': 'LOC'}","{'word': '강원', 'start_idx': 32, 'end_idx': 33, 'entity_type': 'LOC'}",no_relation,김별희,"('충북', '강원')",no_relation,1
308,대한민국1_56,"고조선 멸망을 전후하여 부여, 옥저, 동예, 진국, 삼한 등 여러 나라가 생겨났고, 이후 고구려, 백제, 신라의 삼국 시대로 이어졌으며 이 중 신라가 삼국을 부분적으로 통일하는 한편 북쪽의 발해와 함께 남북국 시대를 형성했다.","{'word': '고조선', 'start_idx': 0, 'end_idx': 2, 'entity_type': 'LOC'}","{'word': '진국', 'start_idx': 25, 'end_idx': 26, 'entity_type': 'LOC'}",no_relation,이원재,"('고조선', '진국')",no_relation,1
309,문재인_150,문용형은 함경남도 흥남의 남평 문씨 집성촌인 솔안마을 출신으로 함흥농고 졸업 후 일제시대 흥남읍사무소에서 농업계 계장으로 근무했다.,"{'word': '함경남도 흥남', 'start_idx': 5, 'end_idx': 11, 'entity_type': 'LOC'}","{'word': '솔안마을', 'start_idx': 25, 'end_idx': 28, 'entity_type': 'LOC'}",loc:subordinate,이원재,"('함경남도 흥남', '솔안마을')",loc:subordinate,8
310,한반도_54,"한편 고구려의 멸망으로부터 약 30여년이 지났을 때, 고구려 출신 장수였던 대조영은 고구려 유민들, 말갈 세력과 함께 한반도 북부-만주-연해주 일대에 발해를 건국했다.","{'word': '연해주', 'start_idx': 76, 'end_idx': 78, 'entity_type': 'LOC'}","{'word': '한반도 북부', 'start_idx': 66, 'end_idx': 71, 'entity_type': 'LOC'}",no_relation,김별희,"('연해주', '한반도 북부')",loc:subordinate,8
311,이승만3_292,"이후 미소공동위원회는 난항을 거듭하다가, 4월 18일 과도정부 수립에 참여할 정당과 단체는 모스크바 3상회의 협정에 대한 지지를 약속하는 선언서에 서명해야 한다는 것을 골자로 하는 공동성명, 즉 '공동성명 제5호(제5호 코뮤니케)'가 발표되었고, 이어서 4월 27일 존 하지가 공동성명 제5호에 서명하더라도 반탁의견 발표를 보장하겠다는 특별성명을 냈다.","{'word': '존 하지', 'start_idx': 149, 'end_idx': 152, 'entity_type': 'PER'}","{'word': '4월 27일', 'start_idx': 142, 'end_idx': 147, 'entity_type': 'DAT'}",no_relation,정준녕,"('존 하지', '4월 27일')",no_relation,1
312,문재인_67,"29일 경남도지사 후보 김경수와 구동태 목사를 방문한 뒤 ""신당이 영남지역에서 정면승부를 해야 한다는 주장에 공감한다""며, ""정당공천제 폐지가 통합의 고리""라는 입장을 보였다.","{'word': '구동태', 'start_idx': 18, 'end_idx': 20, 'entity_type': 'PER'}","{'word': '목사', 'start_idx': 22, 'end_idx': 23, 'entity_type': 'POH'}",per:title,이원재,"('구동태', '목사')",per:title,5
313,문재인_119,"정현백 여성가족부 장관은 홍대 몰카 수사가 '편파 수사'라는 집회 현장에 다녀온 전적이 논란이 되었고, 그 이전에는 여성 비하 논란이 있는 탁현민 청와대 행정관의 경질을 건의해 문재인 대통령 지지자들로부터 비판을 받은 바 있다.","{'word': '탁현민', 'start_idx': 78, 'end_idx': 80, 'entity_type': 'PER'}","{'word': '청와대 행정관', 'start_idx': 82, 'end_idx': 88, 'entity_type': 'POH'}",per:title,이원재,"('탁현민', '청와대 행정관')",per:title,5
314,박정희_66,"그리고 1962년 7월 14일, 개인재산을 기부하여 장학재단인 5·16 장학회를 설립 하였다고 ‘박정희 기념사업회’는 밝히고 있으나 ‘국가정보원 과거사건 진실규명을 통한 발전위원회’가 밝힌 바에 의하면, 당시 국가재건최고회의 의장이었던 박정희가 중앙정보부에 지시하여 '부정축재처리요강'에 의해 이병철 등 기업인 15명과 함께 구속되어 있던 부산 지역의 재력가 김지태(金智泰)를 석방하는 조건으로 부산일보, 한국문화방송, 부산문화방송의 주식과 부일장학회 기본재산 명목의 토지 100,147평을 헌납토록 하였고, 이 재산 중 토지는 국방부에 무상으로 양도하였으며 이후 ""기부받은 재산이 자꾸 유실된다""는 보고를 받고 법무부 장관 고원증에게 장학회의 설립을 지시하여 5·16 장학회를 설립했다.","{'word': '김지태', 'start_idx': 201, 'end_idx': 203, 'entity_type': 'PER'}","{'word': '부일장학회', 'start_idx': 247, 'end_idx': 251, 'entity_type': 'ORG'}",no_relation,이정아,"('김지태', '부일장학회')",no_relation,1
315,이승만3_47,"이승만이 임정법통론을 일시보류한데다가 4월 29일 임시정부 주석 취임까지 거부하자 급기야 5월 2일 경교장에서 이승만, 김구, 조소앙, 조완구, 이청천, 김창숙 등 국민의회 국무위원들과 독촉국민회 지방대표 여러 명이 모여 회담을 하였는데, 이승만의 '임정봉대가 필요할 시기가 올 때까지 보류하자'는 의견과 임시정부 일부요인의 '임정봉대가 필요하다'는 이견을 좁히지 못하였다.","{'word': '이청천', 'start_idx': 81, 'end_idx': 83, 'entity_type': 'PER'}","{'word': '김구', 'start_idx': 67, 'end_idx': 68, 'entity_type': 'PER'}",per:colleagues,정준녕,"('이청천', '김구')",no_relation,1
316,한반도_1,"후에 고조선의 왕이었던 준왕과 다수의 유이민들이 진국에 가서 한(韓)을 세웠고, 후에 마한, 변한, 진한의 삼한이 되었다.","{'word': '한', 'start_idx': 34, 'end_idx': 34, 'entity_type': 'ORG'}","{'word': '준왕', 'start_idx': 13, 'end_idx': 14, 'entity_type': 'PER'}",org:founded_by,김별희,"('한', '준왕')",org:founded_by,2
317,박정희_61,"문명자가 증거로 제시했던 ""사전은 일본 정부의 공식적인 기록이 아니라, 도쿄대학 출판부에서 출판한 개인출판물""이며 ""이 사전 초판(1991)에는 오카모토 미노루라는 이름이 없었는데, 2005년 발간된 2판에 갑자기 이 이름이 추가되었다"" 고 지적했다.","{'word': '문명자', 'start_idx': 0, 'end_idx': 2, 'entity_type': 'PER'}","{'word': '도쿄대학 출판부', 'start_idx': 40, 'end_idx': 47, 'entity_type': 'ORG'}",no_relation,이정아,"('문명자', '도쿄대학 출판부')",no_relation,1
318,대통령_3,"흔히 경칭으로는 각하로도 알려져 있고 대한민국에서는 정부 수립 이후 사용되다가 제4대 장면 정부 때인 1960년 8월 12일 폐지되었으며, 1963년 12월 19일 제3공화국의 출범과 함께 부활했다가 제12대 전두환 정권 때인 1988년 초까지 쓰였다.","{'word': '1963년 12월 19일', 'start_idx': 78, 'end_idx': 90, 'entity_type': 'EVT'}","{'word': '제3공화국의 출범', 'start_idx': 92, 'end_idx': 100, 'entity_type': 'DAT'}",event/artifact:date,임성근,"('1963년 12월 19일', '제3공화국의 출범')",event/artifact:date,9
319,문재인_137,"미국의 시사 잡지 애틀랜틱은 북한의 '핵 드라마'에서 김정은 북한 노동당 위원장과 도널드 트럼프 미국 대통령이 변덕스럽고 매혹적인 스타라면, 이 드라마를 실제 연출하는 이는 문재인 대통령이라고 평가했다.","{'word': '김정은', 'start_idx': 30, 'end_idx': 32, 'entity_type': 'PER'}","{'word': '북한 노동당 위원장', 'start_idx': 34, 'end_idx': 43, 'entity_type': 'POH'}",per:title,이원재,"('김정은', '북한 노동당 위원장')",per:title,5
320,문재인_122,"11월 9일, 김동연 부총리 겸 기획재정부 장관과 장하성 청와대 정책실장이 동시에 교체되었고, 후임으로 각각 홍남기 국무조정실장과 김수현 청와대 사회수석이 지명되었다.","{'word': '김동연', 'start_idx': 8, 'end_idx': 10, 'entity_type': 'PER'}","{'word': '부총리 겸 기획재정부 장관', 'start_idx': 12, 'end_idx': 25, 'entity_type': 'POH'}",per:title,이원재,"('김동연', '부총리 겸 기획재정부 장관')",per:title,5
321,대한민국5_7,"대표적인 K-POP 가수로는 보아, 동방신기, 슈퍼주니어, 소녀시대, 샤이니, 비스트, 티아라, 인피니트, 방탄소년단, 핑클 등이 있다.","{'word': '슈퍼주니어', 'start_idx': 26, 'end_idx': 30, 'entity_type': 'PER'}","{'word': '가수', 'start_idx': 11, 'end_idx': 12, 'entity_type': 'POH'}",per:title,임성근,"('슈퍼주니어', '가수')",per:title,5
322,대한민국1_16,"중화인민공화국, 중화민국, 일본, 베트남 등 주로 동아시아에 있는 한자 문화권 국가들에서도 일상에서 대한민국을 간단히 한국(, , )이라 부른다.","{'word': '동아시아', 'start_idx': 28, 'end_idx': 31, 'entity_type': 'LOC'}","{'word': '중화인민공화국', 'start_idx': 0, 'end_idx': 6, 'entity_type': 'LOC'}",loc:subordinate,이원재,"('동아시아', '중화인민공화국')",loc:subordinate,8
323,대한민국5_29,"라디오 방송의 경우 지상파 방송사인 KBS, MBC, SBS, EBS가 점유하는 주파수와 기타 CBS (대한민국의 방송사)(CBS), 극동방송(FEBC), 불교방송(BBS), 평화방송(PBC), 원음방송(WBS) 등 종교방송의 주파수, 교통안내 전문 방송인 교통방송(서울은 TBS, 기타 지역은 TBN 한국교통방송), 국악 전문의 국악방송, 그리고 국방홍보 목적의 국군방송 등의 여러 방송사가 존재한다.","{'word': 'WBS', 'start_idx': 114, 'end_idx': 116, 'entity_type': 'ORG'}","{'word': 'PBC', 'start_idx': 103, 'end_idx': 105, 'entity_type': 'ORG'}",no_relation,임성근,"('WBS', 'PBC')",no_relation,1
324,문재인_103,노무현 전 대통령이 한미 FTA를 추진해 기존 지지층들의 반발을 샀던 것과 비슷한 측면이 일부 있다.,"{'word': '노무현', 'start_idx': 0, 'end_idx': 2, 'entity_type': 'PER'}","{'word': '전 대통령', 'start_idx': 4, 'end_idx': 8, 'entity_type': 'POH'}",per:title,이원재,"('노무현', '전 대통령')",per:title,5
325,대한민국4_33,"이 외에도 대구에는 3개 노선, 광주와 대전에는 1개 노선이 운영되는 등 일부 광역시를 중심으로 도시철도가 마련되었다.","{'word': '광주', 'start_idx': 18, 'end_idx': 19, 'entity_type': 'LOC'}","{'word': '대구', 'start_idx': 6, 'end_idx': 7, 'entity_type': 'LOC'}",no_relation,정준녕,"('광주', '대구')",no_relation,1
326,이승만3_289,"1946년 3월 25일 이승만은 돈암장에서 가진 기자회견에서 여러 가지 풍문에 대한 입장 정리를 하였다. ""민주의원은 처음부터 신탁을 반대하여 왔고 지금도 반대하는 것이다. (중략) 우리 민의로 하지 않고 미소공위의 자유로 (정부를)조직하는 것은 한민족 전체가 받아들이지 않을 것""이라고 말했다.","{'word': '이승만', 'start_idx': 13, 'end_idx': 15, 'entity_type': 'PER'}","{'word': '1946년 3월 25일', 'start_idx': 0, 'end_idx': 11, 'entity_type': 'DAT'}",no_relation,정준녕,"('이승만', '1946년 3월 25일')",no_relation,1
327,문재인_195,"11월 26일 열린 촛불집회에 참석하여 ""200만 촛불이 세상을 바꾸는 횃불이 될 것""이라고 발언했으며, ""박근혜 대통령 스스로 내려오든 탄핵으로 끌려 내려오든 박 대통령 퇴진은 시간 문제"", ""그렇다면 박 대통령은 한시라도 빨리 스스로 내려오는 것이 국민들을 덜 고생시키고 국정 공백과 국정 혼란을 최소화하는 길""이라고 박근혜의 하야를 촉구했다.","{'word': '촛불집회', 'start_idx': 11, 'end_idx': 14, 'entity_type': 'EVT'}","{'word': '11월 26일', 'start_idx': 0, 'end_idx': 6, 'entity_type': 'DAT'}",event/artifact:date,이원재,"('촛불집회', '11월 26일')",event/artifact:date,9
328,박근혜2_32,전태일의 남동생 전태삼도 박근혜는 22명의 쌍용차 사망 노동자들의 분향소부터 방문하였어야 한다면서 새누리당사 앞에서 20일 넘게 대책을 요구하는 쌍용차 해고 노조원들의 요구엔 묵묵부답이면서 전태일 재단을 방문하는 것은 앞뒤가 맞지 않는다고 비판하였다.,"{'word': '전태삼', 'start_idx': 9, 'end_idx': 11, 'entity_type': 'PER'}","{'word': '전태일', 'start_idx': 0, 'end_idx': 2, 'entity_type': 'PER'}",no_relation,김별희,"('전태삼', '전태일')",no_relation,1
329,대한민국2_45,"그러나 이범석, 장택상 등의 성장을 두려워한 이승만은 이들을 제거하고 이기붕 계열을 등용한다.","{'word': '장택상', 'start_idx': 9, 'end_idx': 11, 'entity_type': 'PER'}","{'word': '이승만', 'start_idx': 25, 'end_idx': 27, 'entity_type': 'PER'}",no_relation,이정아,"('장택상', '이승만')",no_relation,1
330,박근혜2_40,"박근혜 후보의 인혁당 사건에 대한 발언에 대해 각계 각층으로부터 비판이 잇따르자, 2012년 9월 24일, 박근혜 후보는 5.16과 유신, 인혁당 사건 등의 과거사에 대해 사과하였다.","{'word': '인혁당 사건', 'start_idx': 8, 'end_idx': 13, 'entity_type': 'EVT'}","{'word': '2012년 9월 24일', 'start_idx': 46, 'end_idx': 57, 'entity_type': 'DAT'}",no_relation,김별희,"('인혁당 사건', '2012년 9월 24일')",event/artifact:date,9
331,대한민국2_28,"2016년 제20대 총선에서 여소야대 국면에 처하면서 정치적 난관에 처한 박근혜 정부는, 같은해 10월 민간인 신분인 최순실 씨의 국정 농단 사태가 폭로됨에 따라 박근혜 대통령 퇴진 운동이 시작되었고, 국회가 박근혜 대통령 탄핵 소추안을 가결시키며 박근혜 대통령의 권한이 정지, 황교안 대통령 권한대행 체제가 확립되었다.","{'word': '박근혜', 'start_idx': 91, 'end_idx': 93, 'entity_type': 'PER'}","{'word': '대통령', 'start_idx': 95, 'end_idx': 97, 'entity_type': 'POH'}",per:title,이정아,"('박근혜', '대통령')",per:title,5
332,문재인_40,"이후, 8월 25일부터 9월 16일까지 열린 국민참여경선에서 손학규, 김두관, 정세균과 겨루어 전국 순회경선 13회 전승을 거두며 민주통합당의 제18대 대통령 선거 후보로 선출되었다.","{'word': '김두관', 'start_idx': 39, 'end_idx': 41, 'entity_type': 'PER'}","{'word': '정세균', 'start_idx': 44, 'end_idx': 46, 'entity_type': 'PER'}",per:colleagues,이원재,"('김두관', '정세균')",no_relation,1
333,윤석열_58,"2017년 3월 10일 박근혜가 파면되고 제19대 대선에서 문재인 대통령이 당선된 후 문재인 정부에서 제59대 서울중앙지방검찰청 검사장을 지냈으며, 2019년 7월 제43대 검찰총장으로 임명되었다.","{'word': '박근혜', 'start_idx': 13, 'end_idx': 15, 'entity_type': 'PER'}","{'word': '제59대 서울중앙지방검찰청 검사장', 'start_idx': 57, 'end_idx': 74, 'entity_type': 'POH'}",no_relation,정준녕,"('박근혜', '제59대 서울중앙지방검찰청 검사장')",no_relation,1
334,대한민국3_30,그 뒤 운요호 사건을 계기로 조선은 쇄국정책을 풀고 세계열강과 통상조약을 맺게 되자 미국은 1882년에 조선과 통상조약을 맺어 공식적으로 외교관계를 가지게 된다.,"{'word': '운요호 사건', 'start_idx': 4, 'end_idx': 9, 'entity_type': 'EVT'}","{'word': '1882년', 'start_idx': 51, 'end_idx': 55, 'entity_type': 'DAT'}",no_relation,김별희,"('운요호 사건', '1882년')",event/artifact:date,9
335,박정희_23,"박정희를 친일파로 분류하지 않은 친일반민족행위진상규명위원회는 혈서에 관해 ""민족문제연구소가 공개한 박정희 전 대통령이 친일 혈서를 작성했다는 만주신문 기사도 사전 발간 직전에 알게 돼 다시 거론할 수 없었다""고 밝혔다.","{'word': '박정희', 'start_idx': 55, 'end_idx': 57, 'entity_type': 'PER'}","{'word': '전 대통령', 'start_idx': 59, 'end_idx': 63, 'entity_type': 'POH'}",per:title,이정아,"('박정희', '전 대통령')",per:title,5
336,대한민국2_32,"1945년 12월에 모스크바 3상 회의에서 신탁통치안 문제를 놓고 한반도 내에는 좌, 우익 세력간 대립이 격화되었다.","{'word': '모스크바 3상 회의', 'start_idx': 11, 'end_idx': 20, 'entity_type': 'EVT'}","{'word': '1945년', 'start_idx': 0, 'end_idx': 4, 'entity_type': 'DAT'}",event/artifact:date,이정아,"('모스크바 3상 회의', '1945년')",event/artifact:date,9
337,이승만3_190,"윤보선의 사회로 시작되어 오세창의 개회사, 이인의 봉영문 낭독, 권동진의 만세삼창이 이어진 뒤 봉영문은 권동진, 김성수, 이인을 통해 김구에게 전달되었다.","{'word': '윤보선', 'start_idx': 0, 'end_idx': 2, 'entity_type': 'PER'}","{'word': '김성수', 'start_idx': 63, 'end_idx': 65, 'entity_type': 'PER'}",no_relation,정준녕,"('윤보선', '김성수')",per:colleagues,4
338,문재인_165,"이번 프로젝트의 취지가 지역균형발전인 점을 고려해 서울, 경기, 인천 등 수도권을 대상으로 하는 사업은 예타 면제 대상에서 원칙적으로 제외되었으나, 서울 지하철 7호선의 옥정-포천 연장선은 수도권이지만 낙후된 접경지역을 고려하여 예타 면제 대상에 포함되었다.","{'word': '수도권', 'start_idx': 106, 'end_idx': 108, 'entity_type': 'LOC'}","{'word': '옥정-포천', 'start_idx': 95, 'end_idx': 99, 'entity_type': 'LOC'}",loc:subordinate,이원재,"('수도권', '옥정-포천')",loc:subordinate,8
339,이승만3_103,1947년 9월 21일 이청천이 단장으로 있는 대동청년단의 총재로 취임하였다.,"{'word': '이청천', 'start_idx': 13, 'end_idx': 15, 'entity_type': 'PER'}","{'word': '단장', 'start_idx': 18, 'end_idx': 19, 'entity_type': 'POH'}",per:title,정준녕,"('이청천', '단장')",per:title,5
340,윤석열_66,2020년 12월 24일 오후10시 경 서울행정법원은 윤석열 검찰총장이 추미애 법무부 장관을 상대로 제기한 정직 2개월 징계에 대한 집행정지 신청을 인용 결정하였다.,"{'word': '윤석열', 'start_idx': 30, 'end_idx': 32, 'entity_type': 'PER'}","{'word': '2020년 12월 24일', 'start_idx': 0, 'end_idx': 12, 'entity_type': 'DAT'}",no_relation,정준녕,"('윤석열', '2020년 12월 24일')",no_relation,1
341,이승만3_119,이윤영의 총리인준이 실패하자 이승만은 이윤영을 지청천과 함께 초대 내각의 무임소 장관에 입각시켰다.,"{'word': '지청천', 'start_idx': 26, 'end_idx': 28, 'entity_type': 'PER'}","{'word': '무임소 장관', 'start_idx': 41, 'end_idx': 46, 'entity_type': 'POH'}",per:title,정준녕,"('지청천', '무임소 장관')",per:title,5
342,이승만3_285,"1946년 1월 14일 이승만은 정례기자단회견에서 신탁통치 찬성으로 급선회한 공산주의자들을 친일파와 다름없는 매국노라고 단정하고 결별을 선언하였다.""...파괴자와 건설자가 어떻게 합동되며 애국자와 매국자가 어떻게 한 길을 갈 수 있을까. (중략) 이후에 우리가 국권을 회복한 후에는 이 분자들에게도 친일분자와 같은 대우아래 우리 민족의 재판마당에서 우리가 이 사람들에게 물을 말이 있을 것이다.""1946년 1월 16일 미소공동위원회(미소공위) 예비회담이 개최되자 각 정당과 사회단체는 서둘러 반탁진영과 찬탁진영을 구축하기 시작했다.","{'word': '이승만', 'start_idx': 13, 'end_idx': 15, 'entity_type': 'PER'}","{'word': '1946년 1월 14일', 'start_idx': 0, 'end_idx': 11, 'entity_type': 'DAT'}",no_relation,정준녕,"('이승만', '1946년 1월 14일')",no_relation,1
343,대한민국1_22,제주도에는 대한민국에서 가장 높은 산이자 사화산인 한라산이 있다.,"{'word': '제주도', 'start_idx': 0, 'end_idx': 2, 'entity_type': 'LOC'}","{'word': '한라산', 'start_idx': 28, 'end_idx': 30, 'entity_type': 'LOC'}",loc:subordinate,이원재,"('제주도', '한라산')",loc:subordinate,8
344,문재인_249,"강남 3구를 비롯한 서울 11개구와 세종시를 투기지역으로, 투기지역 및 서울 14개구와 경기도 과천시를 투기과열지구로, 투기과열지구 및 부산 7개구와 및 경기도 6개시를 조정대상지역으로 지정했고, 투기지역과 투기과열지구의 주택담보대출비율(LTV)·총부채상환비율(DTI)을 각각 60%와 50%에서 40%로 일괄 하향 조정하기로 했다.","{'word': '서울', 'start_idx': 40, 'end_idx': 41, 'entity_type': 'LOC'}","{'word': '경기도 과천시', 'start_idx': 49, 'end_idx': 55, 'entity_type': 'LOC'}",no_relation,이원재,"('서울', '경기도 과천시')",loc:subordinate,8
345,대한민국3_4,2013년 6월 대한민국의 대통령 박근혜가 중화인민공화국 베이징 시를 방문하여 중화인민공화국의 국가주석 시진핑과 정상회담을 가졌다.,"{'word': '시진핑', 'start_idx': 58, 'end_idx': 60, 'entity_type': 'PER'}","{'word': '중화인민공화국의 국가주석', 'start_idx': 44, 'end_idx': 56, 'entity_type': 'POH'}",per:title,김별희,"('시진핑', '중화인민공화국의 국가주석')",per:title,5
346,박근혜1_35,"2004년 제17대 국회에서 당시 한나라당 대표를 맡고 있던 박근혜와 함께 원내대표로 활동하였던 김덕룡은 박근혜가 소통이 안 되는 것을 넘어 ""먹통""이라고 평가하면서, 당시 박근혜에게 정수장학회 문제를 털고 넘어가야 한다고 조언을 했지만 자신의 조언을 거부한 것은 물론 이후 관계가 소원해졌다는 일화를 예로 들었다.","{'word': '김덕룡', 'start_idx': 54, 'end_idx': 56, 'entity_type': 'PER'}","{'word': '원내대표', 'start_idx': 42, 'end_idx': 45, 'entity_type': 'POH'}",per:title,이정아,"('김덕룡', '원내대표')",per:title,5
347,한반도_45,"기원전 2세기에 이르러서는 만주에 위치했던 부여와 더불어 옥저, 동예, 삼한이 출현하게 되었는데 이 시기를 원삼국 시대라고 한다.","{'word': '부여', 'start_idx': 24, 'end_idx': 25, 'entity_type': 'ORG'}","{'word': '동예', 'start_idx': 36, 'end_idx': 37, 'entity_type': 'ORG'}",no_relation,김별희,"('부여', '동예')",no_relation,1
348,박근혜1_65,박근혜는 이후 대구 달성군 유가읍 대구테크노폴리스 인근의 자택을 구입하여 거주하고 있다.,"{'word': '박근혜', 'start_idx': 0, 'end_idx': 2, 'entity_type': 'PER'}","{'word': '대구 달성군 유가읍 대구테크노폴리스', 'start_idx': 8, 'end_idx': 26, 'entity_type': 'LOC'}",no_relation,이정아,"('박근혜', '대구 달성군 유가읍 대구테크노폴리스')",no_relation,1
349,대한민국3_21,2002년에는 양국이 공동 주관하여 한일 월드컵을 개최하기도 하였다.,"{'word': '한일 월드컵', 'start_idx': 20, 'end_idx': 25, 'entity_type': 'EVT'}","{'word': '2002년', 'start_idx': 0, 'end_idx': 4, 'entity_type': 'DAT'}",event/artifact:date,김별희,"('한일 월드컵', '2002년')",event/artifact:date,9
350,대한민국5_24,"2008년 한국언론재단에서 조사한 자료에 따르면 시장점유율은 조선일보 11.9%, 중앙일보 9.1%, 동아일보 6.6%, 경향신문 2.7%, 한겨레신문 1.7%의 순으로 나타나고 있다.","{'word': '동아일보', 'start_idx': 57, 'end_idx': 60, 'entity_type': 'ORG'}","{'word': '경향신문', 'start_idx': 68, 'end_idx': 71, 'entity_type': 'ORG'}",no_relation,임성근,"('동아일보', '경향신문')",no_relation,1
351,이승만3_230,1947년 6월 30일 하지는 이승만·김구 세력 내부의 고위관계자로부터 이승만·김구가 정치암살과 테러를 계획했다는 밀고가 들어왔다면서 이승만을 추궁했다.,"{'word': '하지', 'start_idx': 13, 'end_idx': 14, 'entity_type': 'PER'}","{'word': '이승만', 'start_idx': 75, 'end_idx': 77, 'entity_type': 'PER'}",no_relation,정준녕,"('하지', '이승만')",no_relation,1
352,문재인_148,"이후 문재인은 몇몇 로펌의 영입 제의를 거절하고, 고향인 부산으로 내려갔다.","{'word': '문재인', 'start_idx': 3, 'end_idx': 5, 'entity_type': 'PER'}","{'word': '부산', 'start_idx': 32, 'end_idx': 33, 'entity_type': 'LOC'}",per:origin,이원재,"('문재인', '부산')",per:origin,7
353,이승만3_138,1945년 10월 23일 각 정당·단체 대표 200여 명이 모여 이승만을 정점으로 소집한 회합에서 독립촉성중앙협의회의 회장으로 추대되었다.,"{'word': '이승만', 'start_idx': 36, 'end_idx': 38, 'entity_type': 'PER'}","{'word': '1945년 10월 23일', 'start_idx': 0, 'end_idx': 12, 'entity_type': 'DAT'}",per:inauguration/removal_date,정준녕,"('이승만', '1945년 10월 23일')",no_relation,1
