,id,sentence,subject_entity,object_entity,label,annotator,pair,label_,label_num
611,대한민국1_13,"중화인민공화국, 중화민국, 일본, 베트남 등 주로 동아시아에 있는 한자 문화권 국가들에서도 일상에서 대한민국을 간단히 한국(, , )이라 부른다.","{'word': '동아시아', 'start_idx': 28, 'end_idx': 31, 'entity_type': 'LOC'}","{'word': '베트남', 'start_idx': 19, 'end_idx': 21, 'entity_type': 'LOC'}",loc:subordinate,이원재,"('동아시아', '베트남')",loc:subordinate,8
612,문재인_11,문재인은 졸업 후 1971년 종로학원 진입 시험에서 일등을 하며 학원비를 면제받고 재수를 시작하였다고 알려진다.,"{'word': '문재인', 'start_idx': 0, 'end_idx': 2, 'entity_type': 'PER'}","{'word': '종로학원', 'start_idx': 16, 'end_idx': 19, 'entity_type': 'ORG'}",per:employee_of,이원재,"('문재인', '종로학원')",no_relation,1
613,이승만3_42,"이승만이 임정법통론을 일시보류한데다가 4월 29일 임시정부 주석 취임까지 거부하자 급기야 5월 2일 경교장에서 이승만, 김구, 조소앙, 조완구, 이청천, 김창숙 등 국민의회 국무위원들과 독촉국민회 지방대표 여러 명이 모여 회담을 하였는데, 이승만의 '임정봉대가 필요할 시기가 올 때까지 보류하자'는 의견과 임시정부 일부요인의 '임정봉대가 필요하다'는 이견을 좁히지 못하였다.","{'word': '이승만', 'start_idx': 62, 'end_idx': 64, 'entity_type': 'PER'}","{'word': '조완구', 'start_idx': 76, 'end_idx': 78, 'entity_type': 'PER'}",per:colleagues,정준녕,"('이승만', '조완구')",per:colleagues,4
614,문재인_251,"서울·세종 전역과 부산·경기 일부 등 집값이 급등한 조정대상지역 2주택 이상 보유자에 대해 주택분 종합부동산세 최고세율을 참여정부 수준 이상인 최고 3.2%로 중과하고, 세 부담 상한도 150%에서 300%로 올린다.","{'word': '서울', 'start_idx': 0, 'end_idx': 1, 'entity_type': 'LOC'}","{'word': '세종', 'start_idx': 3, 'end_idx': 4, 'entity_type': 'LOC'}",no_relation,이원재,"('서울', '세종')",no_relation,1
615,박근혜1_52,"2017년 3월 10일 헌법재판소에서 만장일치로 탄핵 소추안을 인용하면서 박근혜는 대통령직에서 파면, 헌정 사상 최초로 탄핵된 대통령이라는 불명예를 안았다.","{'word': '박근혜', 'start_idx': 41, 'end_idx': 43, 'entity_type': 'PER'}","{'word': '헌법재판소', 'start_idx': 13, 'end_idx': 17, 'entity_type': 'ORG'}",no_relation,이정아,"('박근혜', '헌법재판소')",no_relation,1
616,박근혜2_39,"2012년 9월 12일 인혁당 사건 유족들은 새누리당 앞에서 기자 회견을 열고 ""이미 박 후보는 2005년에 국정원이 인혁당 사건이 조작되었다는 조사결과를 발표할때도 '한 마디로 가치가 없는 것이며, 모함'이라고 발언한 바 있다""며 ""사람이 억울하게 8명이나 사형당한 사건을 가치가 없고 모함이라고 말하는 박 후보는 최소한 인간에 대한 예의조차 있는가.","{'word': '인혁당 사건', 'start_idx': 66, 'end_idx': 71, 'entity_type': 'EVT'}","{'word': '2005년', 'start_idx': 54, 'end_idx': 58, 'entity_type': 'DAT'}",no_relation,김별희,"('인혁당 사건', '2005년')",event/artifact:date,9
617,문재인_141,"진보 성향의 주상영 건국대 교수조차 ""기업구조조정이나 공공부문 개혁, 증세 논의 등 경제 효율성 향상 정책이 없을 경우 금융위기 발생, 불평등 심화, 수요 부족의 문제를 겪게 될 것""이라고 지적했고, 더불어민주당 국민경제상황실 부단장을 맡았던 주진형 전 한화투자증권 대표는 최저임금 인상 정책에 대해 ""부모 없는 아이""라고 강하게 비판하기도 하였다.","{'word': '주진형', 'start_idx': 136, 'end_idx': 138, 'entity_type': 'PER'}","{'word': '전 한화투자증권 대표', 'start_idx': 140, 'end_idx': 150, 'entity_type': 'POH'}",per:title,이원재,"('주진형', '전 한화투자증권 대표')",per:title,5
618,이승만3_236,2월 9일 김구와 김규식은 유엔 한국 임시위원단의 크리슈나 메논에게 남북한 동시 총선거 성립을 위한 남북협상을 재차 제안하였다.,"{'word': '김구', 'start_idx': 6, 'end_idx': 7, 'entity_type': 'PER'}","{'word': '크리슈나 메논', 'start_idx': 28, 'end_idx': 34, 'entity_type': 'PER'}",no_relation,정준녕,"('김구', '크리슈나 메논')",no_relation,1
619,한반도_22,"서해안은 압록강 하구에서 전남 해남에 이르는 해안으로, 직선거리는 650km이나, 실제거리는 4,719km에 달한다.","{'word': '전남', 'start_idx': 14, 'end_idx': 15, 'entity_type': 'LOC'}","{'word': '해남', 'start_idx': 17, 'end_idx': 18, 'entity_type': 'LOC'}",loc:subordinate,김별희,"('전남', '해남')",loc:subordinate,8
620,국가장_2,"과거 정부가 공식 주관하는 장례의식은 국장(國葬)과 국민장(國民葬)으로 구분하였으나, 「국가장법」(전부개정 법률 제10741호 2011년 5월 30일 시행령에 따라 국가장으로 통합되면서 폐지되었다.","{'word': '법률 제10741호', 'start_idx': 60, 'end_idx': 69, 'entity_type': 'POH'}","{'word': '2011년 5월 30일', 'start_idx': 71, 'end_idx': 82, 'entity_type': 'DAT'}",event/artifact:date,이원재,"('법률 제10741호', '2011년 5월 30일')",event/artifact:date,9
621,대통령_1,미국의 헌법의 모태가 된 1787년의 필라델피아 헌법회의의 구성원들이 영국 헌정의 부정적 측면에 대한 반성을 바탕으로 발전시킨 정부 형태 자유민주주의에 뿌리를 두고 샤를 루이 드 세콩다 몽테스키외의 권력분립 사상을 충실히 수용하여 탄생하였다.,"{'word': '미국', 'start_idx': 0, 'end_idx': 1, 'entity_type': 'LOC'}","{'word': '필라델피아', 'start_idx': 21, 'end_idx': 25, 'entity_type': 'LOC'}",loc:subordinate,임성근,"('미국', '필라델피아')",loc:subordinate,8
622,대한민국1_47,"또한 대한민국은 주요 20개국 (G20), 경제 협력 개발 기구 (OECD), 개발 원조 위원회 (DAC), 파리 클럽 등의 회원국이다.","{'word': '파리 클럽', 'start_idx': 61, 'end_idx': 65, 'entity_type': 'LOC'}","{'word': 'OECD', 'start_idx': 37, 'end_idx': 40, 'entity_type': 'LOC'}",no_relation,이원재,"('파리 클럽', 'OECD')",no_relation,1
623,이승만3_127,"초대 내각을 구성한 장관으로는 외무 장택상, 내무 윤치영, 재무 김도연, 법무 이인, 국방 이범석(겸임), 문교 안호상, 농림 조봉암, 상공 임영신, 사회 전진한, 교통 민희식, 체신 윤석구, 무임소국무위원 이청천(지청천)·이윤영 등이 임명되었다.","{'word': '이범석', 'start_idx': 51, 'end_idx': 53, 'entity_type': 'PER'}","{'word': '장관', 'start_idx': 11, 'end_idx': 12, 'entity_type': 'POH'}",per:title,정준녕,"('이범석', '장관')",per:title,5
624,박정희_55,한편 민족문제연구소는 인터넷 일간지 오마이뉴스를 통해 교사시절 박정희가 만주군에 지원할 때 쓴 혈서가 그가 일본제국에 충성을 맹세한 친일파임을 뒷받침하는 자료 근거라고 주장한다.,"{'word': '박정희', 'start_idx': 35, 'end_idx': 37, 'entity_type': 'PER'}","{'word': '민족문제연구소', 'start_idx': 3, 'end_idx': 9, 'entity_type': 'ORG'}",no_relation,이정아,"('박정희', '민족문제연구소')",no_relation,1
625,이승만3_125,"초대 내각을 구성한 장관으로는 외무 장택상, 내무 윤치영, 재무 김도연, 법무 이인, 국방 이범석(겸임), 문교 안호상, 농림 조봉암, 상공 임영신, 사회 전진한, 교통 민희식, 체신 윤석구, 무임소국무위원 이청천(지청천)·이윤영 등이 임명되었다.","{'word': '김도연', 'start_idx': 36, 'end_idx': 38, 'entity_type': 'PER'}","{'word': '장관', 'start_idx': 11, 'end_idx': 12, 'entity_type': 'POH'}",per:title,정준녕,"('김도연', '장관')",per:title,5
626,대한민국3_12,2007년 한미자유무역협정이 체결되었고 문서 공개 이후 한동안 상당한 논란에 휩싸였다.,"{'word': '한미자유무역협정', 'start_idx': 6, 'end_idx': 13, 'entity_type': 'POH'}","{'word': '2007년', 'start_idx': 0, 'end_idx': 4, 'entity_type': 'DAT'}",event/artifact:date,김별희,"('한미자유무역협정', '2007년')",event/artifact:date,9
627,대한민국1_43,그 과정에서 1990년대 말 외환 위기 등의 부침이 있기도 했다.,"{'word': '외환 위기', 'start_idx': 16, 'end_idx': 20, 'entity_type': 'EVT'}","{'word': '1990년대 말', 'start_idx': 7, 'end_idx': 14, 'entity_type': 'DAT'}",event/artifact:date,이원재,"('외환 위기', '1990년대 말')",event/artifact:date,9
628,대한민국2_35,1997년 제15대 대선에서 새정치국민회의의 김대중 후보가 당선되면서 헌정 사상 최초의 평화적인 정권교체가 실현되었다.,"{'word': '제15대 대선', 'start_idx': 6, 'end_idx': 12, 'entity_type': 'EVT'}","{'word': '1997년', 'start_idx': 0, 'end_idx': 4, 'entity_type': 'DAT'}",event/artifact:date,이정아,"('제15대 대선', '1997년')",event/artifact:date,9
629,문재인_237,"11월 9일, 김동연 부총리 겸 기획재정부 장관과 장하성 청와대 정책실장이 동시에 교체되었고, 후임으로 각각 홍남기 국무조정실장과 김수현 청와대 사회수석이 지명되었다.","{'word': '홍남기', 'start_idx': 61, 'end_idx': 63, 'entity_type': 'PER'}","{'word': '국무조정실장', 'start_idx': 65, 'end_idx': 70, 'entity_type': 'POH'}",no_relation,이원재,"('홍남기', '국무조정실장')",per:title,5
630,문재인_246,"그러나 민정수석을 그만두고 네팔 산행 도중 연락이 두절된 상황에서 영자 신문을 통해 노무현 대통령의 탄핵 소식을 듣고 즉시 귀국하여 변호인단을 꾸렸으며, 2005년 다시 청와대에 들어가 대통령비서실 시민사회수석, 민정수석, 정무특보를 거쳐 참여정부 마지막 대통령비서실장을 지냈다.","{'word': '노무현', 'start_idx': 47, 'end_idx': 49, 'entity_type': 'PER'}","{'word': '네팔', 'start_idx': 15, 'end_idx': 16, 'entity_type': 'LOC'}",no_relation,이원재,"('노무현', '네팔')",no_relation,1
631,문재인_7,"문재인은 남항국민학교에 다니던 시절, 극심한 가난 때문에 학교 바로 위의 '신선성당'에서 양동이를 들고 줄을 서서 정기적으로 배급을 타먹어야 했다고 말했다.","{'word': '문재인', 'start_idx': 0, 'end_idx': 2, 'entity_type': 'PER'}","{'word': '남항국민학교', 'start_idx': 5, 'end_idx': 10, 'entity_type': 'ORG'}",per:employee_of,이원재,"('문재인', '남항국민학교')",no_relation,1
632,이승만3_345,1948년 8월 2일 이승만은 이범석이 건의한 김성수 천거 8명 중 3명만을 기용하였고 나머지는 무산시켰다.,"{'word': '이승만', 'start_idx': 12, 'end_idx': 14, 'entity_type': 'PER'}","{'word': '1948년 8월 2일', 'start_idx': 0, 'end_idx': 10, 'entity_type': 'DAT'}",no_relation,정준녕,"('이승만', '1948년 8월 2일')",no_relation,1
633,대한민국1_40,"1892년 외국인이 자주 보는 잡지 〈""The Korean Repository"" 〉 5월 호에는 “미국 국무부와 영국의 왕립지리학회는 우리가 차용한 이 땅의 이름을 아주 조리 있게 Korea로 표기하기 시작했던 것”이라는 내용이 나온다.","{'word': '〈""The Korean Repository"" 〉 5월 호', 'start_idx': 20, 'end_idx': 50, 'entity_type': 'POH'}","{'word': '1892년', 'start_idx': 0, 'end_idx': 4, 'entity_type': 'DAT'}",event/artifact:date,이원재,"('〈""The Korean Repository"" 〉 5월 호', '1892년')",event/artifact:date,9
634,이승만3_342,"1948년 7월 28일 이화장에서 이승만은 국무총리인선 문제에 관해 ""이 국회에서는 두 정당(한민당 및 한독당)이 각각 내정하는 사람들이 있어서 국회를 결박 부동하게 만들어 놓아...""라고 비판 담화를 발표하였다.","{'word': '이승만', 'start_idx': 19, 'end_idx': 21, 'entity_type': 'PER'}","{'word': '1948년 7월 28일', 'start_idx': 0, 'end_idx': 11, 'entity_type': 'DAT'}",no_relation,정준녕,"('이승만', '1948년 7월 28일')",no_relation,1
635,문재인_177,2012년 제19대 총선에서 부산 사상구에 출마하여 당선되었다.,"{'word': '제19대 총선', 'start_idx': 6, 'end_idx': 12, 'entity_type': 'EVT'}","{'word': '2012년', 'start_idx': 0, 'end_idx': 4, 'entity_type': 'DAT'}",event/artifact:date,이원재,"('제19대 총선', '2012년')",event/artifact:date,9
636,이승만3_16,"즉 한국독립당이 미소공위에 불참한다고 하자, 이에 반발한 안재홍·박용희(朴容羲) 등 혁신파는 신한국민당을, 권태석 등 민주파는 민주한독당을 각각 분리 결성하고 임정수립대책협의회에 합류했다.","{'word': '안재홍', 'start_idx': 32, 'end_idx': 34, 'entity_type': 'PER'}","{'word': '혁신파', 'start_idx': 47, 'end_idx': 49, 'entity_type': 'ORG'}",per:employee_of,정준녕,"('안재홍', '혁신파')",per:employee_of,3
637,이승만3_44,"이승만이 임정법통론을 일시보류한데다가 4월 29일 임시정부 주석 취임까지 거부하자 급기야 5월 2일 경교장에서 이승만, 김구, 조소앙, 조완구, 이청천, 김창숙 등 국민의회 국무위원들과 독촉국민회 지방대표 여러 명이 모여 회담을 하였는데, 이승만의 '임정봉대가 필요할 시기가 올 때까지 보류하자'는 의견과 임시정부 일부요인의 '임정봉대가 필요하다'는 이견을 좁히지 못하였다.","{'word': '이승만', 'start_idx': 62, 'end_idx': 64, 'entity_type': 'PER'}","{'word': '김창숙', 'start_idx': 86, 'end_idx': 88, 'entity_type': 'PER'}",per:colleagues,정준녕,"('이승만', '김창숙')",per:colleagues,4
638,대한민국1_32,해안 근처에는 사구·석호 등이 형성되어 있고 먼 해상에 화산섬인 울릉도가 있으며 그보다 동쪽으로 약 87.4km 거리에 대한민국 최동단인 독도가 위치한다.,"{'word': '대한민국', 'start_idx': 67, 'end_idx': 70, 'entity_type': 'LOC'}","{'word': '독도', 'start_idx': 77, 'end_idx': 78, 'entity_type': 'LOC'}",loc:subordinate,이원재,"('대한민국', '독도')",loc:subordinate,8
639,이승만3_26,"초대 내각을 구성한 장관으로는 외무 장택상, 내무 윤치영, 재무 김도연, 법무 이인, 국방 이범석(겸임), 문교 안호상, 농림 조봉암, 상공 임영신, 사회 전진한, 교통 민희식, 체신 윤석구, 무임소국무위원 이청천(지청천)·이윤영 등이 임명되었다.","{'word': '김도연', 'start_idx': 36, 'end_idx': 38, 'entity_type': 'PER'}","{'word': '초대 내각', 'start_idx': 0, 'end_idx': 4, 'entity_type': 'ORG'}",per:employee_of,정준녕,"('김도연', '초대 내각')",per:employee_of,3
640,이승만3_322,1947년 10월 18일 돈암장을 떠나고 윤치영 등 측근들과 독지가들의 모금으로 마련된 이화동의 이화장 사저에 입주하였다.,"{'word': '윤치영', 'start_idx': 23, 'end_idx': 25, 'entity_type': 'PER'}","{'word': '1947년 10월 18일', 'start_idx': 0, 'end_idx': 12, 'entity_type': 'DAT'}",no_relation,정준녕,"('윤치영', '1947년 10월 18일')",no_relation,1
641,문재인_204,11월 19일에 사전 각본없이 자유롭게 진행하는 국민과의 대화를 생방송으로 진행하며 임기 중에 남방정책을 추진하며 아세안연합 10개국과 정상회담을 했던 문재인은 11월 25일부터 한·아세안 특별정상회의와 한·메콩강 정상회의를 잇달아 개최하였다.,"{'word': '한·아세안 특별정상회의', 'start_idx': 100, 'end_idx': 111, 'entity_type': 'EVT'}","{'word': '11월 25일', 'start_idx': 90, 'end_idx': 96, 'entity_type': 'DAT'}",event/artifact:date,이원재,"('한·아세안 특별정상회의', '11월 25일')",event/artifact:date,9
642,문재인_84,"헤리티지 재단의 브루스 클링너 선임연구원은 “미국은 공개적으로는 문재인 대통령과 그의 노력을 지지하며 얼굴에 미소를 띠고 있지만, 미 정부 관계자들과 이야기를 나눠보면 상당수가 문 대통령의 대북 정책에 대해 매우 우려하거나 심지어 분노하고 있다”고 밝혔다.","{'word': '브루스 클링너', 'start_idx': 9, 'end_idx': 15, 'entity_type': 'PER'}","{'word': '선임연구원', 'start_idx': 17, 'end_idx': 21, 'entity_type': 'POH'}",per:title,이원재,"('브루스 클링너', '선임연구원')",per:title,5
643,문재인_159,"발표된 공공택지 17곳은 옛 성동구치소 자리와 대포동 재건마을, 비공개 9개 부지 등 서울 11곳, 광명 하안2 · 의왕 청계2 · 성남 신촌 · 시흥 하중 · 의정부 우정 등 경기 5곳, 검암 역세권 등 인천 1곳이다.","{'word': '의정부', 'start_idx': 90, 'end_idx': 92, 'entity_type': 'LOC'}","{'word': '우정', 'start_idx': 94, 'end_idx': 95, 'entity_type': 'LOC'}",loc:subordinate,이원재,"('의정부', '우정')",loc:subordinate,8
644,문재인_69,"그는 당 대표가 되면 2016년에 치러질 차기 총선에 출마하지 않겠다고 하였으며, 출마 선언 이후 약 5개월 만에 박원순 서울시장을 제치고 대선 후보 지지율 1위를 탈환하였다.","{'word': '박원순', 'start_idx': 64, 'end_idx': 66, 'entity_type': 'PER'}","{'word': '서울시장', 'start_idx': 68, 'end_idx': 71, 'entity_type': 'POH'}",per:title,이원재,"('박원순', '서울시장')",per:title,5
645,이승만3_283,1945년 11월 23일 이승만은 조선일보의 복간을 축하하는 축하문을 발표하였다.,"{'word': '이승만', 'start_idx': 14, 'end_idx': 16, 'entity_type': 'PER'}","{'word': '1945년 11월 23일', 'start_idx': 0, 'end_idx': 12, 'entity_type': 'DAT'}",no_relation,정준녕,"('이승만', '1945년 11월 23일')",no_relation,1
646,이승만3_77,1946년 3월 19일 이승만은 시간적 여유와 신병을 이유로 민주의원 의장직을 사표를 제출했으나 민주의원은 사표를 접수하지 않았다.,"{'word': '이승만', 'start_idx': 13, 'end_idx': 15, 'entity_type': 'PER'}","{'word': '민주의원 의장직', 'start_idx': 34, 'end_idx': 41, 'entity_type': 'POH'}",per:title,정준녕,"('이승만', '민주의원 의장직')",per:title,5
647,이승만3_195,"조선국민학교생도를 선두로 기행렬에 옮기어 행렬은 오후 2시 20분경 안국정 네거리에 이르러 조선생명보험회사 2층에서 축하를 받는 김구를 중심으로 좌우에 이승만, 이시영, 김규식, 류동렬 등 앞에서 ""대한임시정부 만세, 김구 만세, 이승만 만세""를 부르고 경성역 앞에 이르러 해산하였다.","{'word': '김구', 'start_idx': 72, 'end_idx': 73, 'entity_type': 'PER'}","{'word': '김규식', 'start_idx': 95, 'end_idx': 97, 'entity_type': 'PER'}",no_relation,정준녕,"('김구', '김규식')",per:colleagues,4
648,이승만3_310,1947년 1월 24일 김영수에게 무기징역이 구형되었다.,"{'word': '김영수', 'start_idx': 13, 'end_idx': 15, 'entity_type': 'PER'}","{'word': '1947년 1월 24일', 'start_idx': 0, 'end_idx': 11, 'entity_type': 'DAT'}",no_relation,정준녕,"('김영수', '1947년 1월 24일')",no_relation,1
649,문재인_167,"특히 거제, 통영 등 경남과 울산, 전북 군산, 전남 목포 등 고용·산업위기 지역은 지역의 어려움을 추가로 고려했다.","{'word': '경남', 'start_idx': 12, 'end_idx': 13, 'entity_type': 'LOC'}","{'word': '통영', 'start_idx': 7, 'end_idx': 8, 'entity_type': 'LOC'}",loc:subordinate,이원재,"('경남', '통영')",loc:subordinate,8
650,문재인_213,"2016년 1월 19일 기자회견을 열고 더불어민주당 당대표를 사퇴한다고 말했으며, 이에 김종인은 ""그러리라 믿어요"", ""시기의 문제일 뿐""이라고 주장했다.","{'word': '김종인', 'start_idx': 49, 'end_idx': 51, 'entity_type': 'PER'}","{'word': '더불어민주당 당대표', 'start_idx': 22, 'end_idx': 31, 'entity_type': 'ORG'}",no_relation,이원재,"('김종인', '더불어민주당 당대표')",per:title,5
651,이승만3_2,"1월 23일 임시정부 측 혁신계인 조선민족혁명당의 김원봉·성주식(成周寔), 조선민족해방동맹의 김성숙 등 3명은 '임시정부가 중립을 지키지 않고 반탁에 가담해 우익 편향화하고 있다'면서 비상국민회의주비회 탈퇴성명을 하였으며, 임시정부의 장건상도 임시정부와의 결별을 고하였다.","{'word': '성주식', 'start_idx': 32, 'end_idx': 34, 'entity_type': 'PER'}","{'word': '조선민족혁명당', 'start_idx': 19, 'end_idx': 25, 'entity_type': 'ORG'}",per:employee_of,정준녕,"('성주식', '조선민족혁명당')",per:employee_of,3
652,박근혜1_34,"2013년 4월 24일, 중국 외교부장이 윤병세 대한민국 외교부 장관을 만났으며, ""관련국들이 적극적인 조치를 내놓아 문제를 대화와 협상의 궤도로 돌려놓아야 한다""고 강조했다.","{'word': '윤병세', 'start_idx': 23, 'end_idx': 25, 'entity_type': 'PER'}","{'word': '대한민국 외교부 장관', 'start_idx': 27, 'end_idx': 37, 'entity_type': 'POH'}",per:title,이정아,"('윤병세', '대한민국 외교부 장관')",per:title,5
653,문재인_200,"2018년 5월 26일에는 판문점에서 2차 남북정상회담이 이루어졌으며, 지방선거를 하루 앞둔 6월 12일에는 싱가포르에서 북미정상회담이 이루어졌다.","{'word': '2차 남북정상회담', 'start_idx': 21, 'end_idx': 29, 'entity_type': 'EVT'}","{'word': '2018년 5월 26일', 'start_idx': 0, 'end_idx': 11, 'entity_type': 'DAT'}",event/artifact:date,이원재,"('2차 남북정상회담', '2018년 5월 26일')",event/artifact:date,9
654,박근혜1_58,"2010년까지 차기 대선후보 지지율 1위를 지켜온 박근혜의 이런 의견들은 당정에 큰 영향력을 끼쳤으며 친이계는 정부에 협조하지도, 그렇다고 반대하지도 않는 박근혜의 모호한 행보에 대해 불만을 토로하기도 했다.","{'word': '박근혜', 'start_idx': 28, 'end_idx': 30, 'entity_type': 'PER'}","{'word': '친이계', 'start_idx': 57, 'end_idx': 59, 'entity_type': 'ORG'}",no_relation,이정아,"('박근혜', '친이계')",no_relation,1
655,대한민국5_9,"대표적인 K-POP 가수로는 보아, 동방신기, 슈퍼주니어, 소녀시대, 샤이니, 비스트, 티아라, 인피니트, 방탄소년단, 핑클 등이 있다.","{'word': '샤이니', 'start_idx': 39, 'end_idx': 41, 'entity_type': 'PER'}","{'word': '가수', 'start_idx': 11, 'end_idx': 12, 'entity_type': 'POH'}",per:title,임성근,"('샤이니', '가수')",per:title,5
656,대한민국5_1,"한국어 표기에 쓰이는 문자인 한글은 세종대왕이 원로대신들의 반대를 무릅쓰고 언문청(諺文廳) 또는 정음청(正音廳)을 설치하여, 훈민정음이라는 명칭으로 1446년 반포하였다.","{'word': '세종대왕', 'start_idx': 20, 'end_idx': 23, 'entity_type': 'PER'}","{'word': '정음청', 'start_idx': 54, 'end_idx': 56, 'entity_type': 'ORG'}",per:employee_of,임성근,"('세종대왕', '정음청')",org:founded_by,2
657,박근혜2_29,"민주당 쌍용자동차대책 특별위원회 역시, 새누리당사 앞에서 박근혜 후보가 나설 것을 요구하며 노숙농성을 벌이고 있는 해고 노동자들을 먼저 만날 것을 촉구했다.","{'word': '박근혜', 'start_idx': 32, 'end_idx': 34, 'entity_type': 'PER'}","{'word': '민주당 쌍용자동차대책 특별위원회', 'start_idx': 0, 'end_idx': 16, 'entity_type': 'ORG'}",no_relation,김별희,"('박근혜', '민주당 쌍용자동차대책 특별위원회')",no_relation,1
658,이승만3_76,"이승만이 의장에, 김구·김규식이 부의장에 추대되었다.","{'word': '김규식', 'start_idx': 13, 'end_idx': 15, 'entity_type': 'PER'}","{'word': '부의장', 'start_idx': 18, 'end_idx': 20, 'entity_type': 'POH'}",per:title,정준녕,"('김규식', '부의장')",per:title,5
659,문재인_19,"또한 참여정부 들어 검사장으로 승진한 17명 중 문재인과 이호철 비서관의 경남고등학교 동문은 한 명도 없었는데, 두 사람은 동창회에 얼굴을 비추지도 않았고, 고등학교 동창인 고위 공직자가 문재인의 방에 들렀다가 얼굴도 못 본 채 나온 바가 있으며, 청와대 출입기자단과 식사나 환담 자리도 갖지 않았다고 한다.","{'word': '이호철', 'start_idx': 32, 'end_idx': 34, 'entity_type': 'PER'}","{'word': '경남고등학교', 'start_idx': 41, 'end_idx': 46, 'entity_type': 'ORG'}",per:employee_of,이원재,"('이호철', '경남고등학교')",no_relation,1
660,한반도_17,"그들 산맥에는 백두산(白頭山:2,744m)·관모봉(冠帽峰:2,540m)을 비롯한 고봉들이 솟아 있는데, 휴전선 이남에 있는 주요 산은 소백산맥에 속하는 지리산(智異山:1,915m), 태백산맥에 속하는 설악산(雪嶽山:1,708m)·태백산(太白山:1,567m) 등이다.","{'word': '태백산맥', 'start_idx': 102, 'end_idx': 105, 'entity_type': 'LOC'}","{'word': '설악산', 'start_idx': 112, 'end_idx': 114, 'entity_type': 'LOC'}",loc:subordinate,김별희,"('태백산맥', '설악산')",loc:subordinate,8
