,id,sentence,subject_entity,object_entity,label,annotator,pair,label_,label_num
875,대한민국4_2,"1998년 5월 17일에는 성소수자 인권 운동가 오세인이 1997년 자신이 게이임을 가족에게 밝혔다가 추방당한 후, 활동하던 단체 사무실에서 자살하였고, 2003년 4월 26일에는 동성애자를 악마, 사탄 등으로 비판하는 개신교계의 공격과 동성애를 청소년 유해 단어, 음란물로 지정하려는 움직임 등 성소수자 혐오에 저항하는 활동을 하는 시인 겸 작가 육우당이 끝내 자살하게 되는 사건이 있었다.","{'word': '육우당', 'start_idx': 195, 'end_idx': 197, 'entity_type': 'PER'}","{'word': '시인 겸 작가', 'start_idx': 187, 'end_idx': 193, 'entity_type': 'POH'}",per:title,정준녕,"('육우당', '시인 겸 작가')",per:title,5
876,이승만3_318,"이승만이 임정법통론을 일시보류한데다가 4월 29일 임시정부 주석 취임까지 거부하자 급기야 5월 2일 경교장에서 이승만, 김구, 조소앙, 조완구, 이청천, 김창숙 등 국민의회 국무위원들과 독촉국민회 지방대표 여러 명이 모여 회담을 하였는데, 이승만의 '임정봉대가 필요할 시기가 올 때까지 보류하자'는 의견과 임시정부 일부요인의 '임정봉대가 필요하다'는 이견을 좁히지 못하였다.","{'word': '이승만', 'start_idx': 0, 'end_idx': 2, 'entity_type': 'PER'}","{'word': '4월 29일', 'start_idx': 21, 'end_idx': 26, 'entity_type': 'DAT'}",no_relation,정준녕,"('이승만', '4월 29일')",no_relation,1
877,문재인_186,"이후, 8월 25일부터 9월 16일까지 열린 국민참여경선에서 손학규, 김두관, 정세균과 겨루어 전국 순회경선 13회 전승을 거두며 민주통합당의 제18대 대통령 선거 후보로 선출되었다.","{'word': '국민참여경선', 'start_idx': 25, 'end_idx': 30, 'entity_type': 'EVT'}","{'word': '9월 16일', 'start_idx': 13, 'end_idx': 18, 'entity_type': 'DAT'}",event/artifact:date,이원재,"('국민참여경선', '9월 16일')",event/artifact:date,9
878,박근혜1_28,어머니 육영수는 충청북도 옥천군의 대지주인 육종관과 부인 이경령의 차녀로 태어나 배화여자고등보통학교(현재의 배화여자고등학교)를 졸업하고 옥천공립여자전수학교(현재의 옥천여자중학교)에서 가정과 교사로 1년 반 동안 봉직한 경력이 있었다.,"{'word': '육종관', 'start_idx': 24, 'end_idx': 26, 'entity_type': 'PER'}","{'word': '충청북도 옥천군의 대지주', 'start_idx': 9, 'end_idx': 21, 'entity_type': 'POH'}",per:title,이정아,"('육종관', '충청북도 옥천군의 대지주')",per:title,5
879,대한민국2_22,하지만 유엔군이 파병으로 지원하고 유엔군 총사령관 더글러스 맥아더가 9.15일 인천 상륙 작전을 벌여 조선인민군에 반격을 시작하자 얼마 지나지 않아 대한민국은 9월 27일에 서울을 탈환해냈다.,"{'word': '더글러스 맥아더', 'start_idx': 28, 'end_idx': 35, 'entity_type': 'PER'}","{'word': '유엔군 총사령관', 'start_idx': 19, 'end_idx': 26, 'entity_type': 'POH'}",per:title,이정아,"('더글러스 맥아더', '유엔군 총사령관')",per:title,5
880,대한민국1_12,코리아(Korea)란 영문 국호의 어원은 동아시아의 중세 국가인 고려에서 유래하였다.,"{'word': '동아시아', 'start_idx': 23, 'end_idx': 26, 'entity_type': 'LOC'}","{'word': '고려', 'start_idx': 36, 'end_idx': 37, 'entity_type': 'LOC'}",loc:subordinate,이원재,"('동아시아', '고려')",loc:subordinate,8
881,이승만3_165,이 갈등조차 1949년 5월 19일 덕수궁 회동을 통해 점차 봉합되어 갔다.,"{'word': '덕수궁 회동', 'start_idx': 20, 'end_idx': 25, 'entity_type': 'EVT'}","{'word': '1949년 5월 19일', 'start_idx': 7, 'end_idx': 18, 'entity_type': 'DAT'}",event/artifact:date,정준녕,"('덕수궁 회동', '1949년 5월 19일')",event/artifact:date,9
882,이승만3_105,"나와 이승만 박사는 조국의 자주독립을 즉시 실현하자는 목적에 완전한 합의를 보았다""고 하였다.","{'word': '이승만', 'start_idx': 3, 'end_idx': 5, 'entity_type': 'PER'}","{'word': '박사', 'start_idx': 7, 'end_idx': 8, 'entity_type': 'POH'}",per:title,정준녕,"('이승만', '박사')",per:title,5
883,이승만3_5,2월 13일 비상국민회의로부터 최고정무위원 선임권을 위임 받은 이승만·김구는 28인의 비상국민회의 최고정무위원회를 구성하였다.,"{'word': '이승만', 'start_idx': 35, 'end_idx': 37, 'entity_type': 'PER'}","{'word': '비상국민회의 최고정무위원회', 'start_idx': 48, 'end_idx': 61, 'entity_type': 'ORG'}",per:employee_of,정준녕,"('이승만', '비상국민회의 최고정무위원회')",per:employee_of,3
884,박근혜1_66,1979년 10월 26일 아버지 박정희가 살해당하자 며칠 뒤 청와대를 떠나 동생들을 데리고 서울특별시 신당동 사저로 돌아갔다.,"{'word': '박정희', 'start_idx': 18, 'end_idx': 20, 'entity_type': 'PER'}","{'word': '서울특별시 신당동', 'start_idx': 51, 'end_idx': 59, 'entity_type': 'LOC'}",no_relation,이정아,"('박정희', '서울특별시 신당동')",no_relation,1
885,이승만3_80,"1946년 3월 20일 민주의원 총리 김구와 부의장 김규식은 창덕궁 인정전에 있는 민주의원 본부에서 기자회견을 가졌는데, 이 자리에서 김규식은 ""미소공동위원회는 우리의 운명을 장악하느니만치 우리는 힘을 합하여 미소공위가 성공되게끔 협력해야 된다""고 말했다.","{'word': '김규식', 'start_idx': 29, 'end_idx': 31, 'entity_type': 'PER'}","{'word': '부의장', 'start_idx': 25, 'end_idx': 27, 'entity_type': 'POH'}",per:title,정준녕,"('김규식', '부의장')",per:title,5
886,문재인_28,"자유한국당 홍준표 후보, 국민의당 안철수 후보, 바른정당 유승민 후보, 정의당 심상정 후보와 함께 4월 23일, 4월 28일, 5월 2일 세 차례에 걸쳐 진행된 토론에 참석했다.","{'word': '유승민', 'start_idx': 32, 'end_idx': 34, 'entity_type': 'PER'}","{'word': '바른정당', 'start_idx': 27, 'end_idx': 30, 'entity_type': 'ORG'}",per:employee_of,이원재,"('유승민', '바른정당')",per:employee_of,3
887,대한민국4_15,"2000년 이후 자신이 게이임을 커밍아웃한 홍석천을 시작으로 트랜스젠더인 하리수, 이시연 등의 공개적 활동 등으로 성소수자들에 대한 맹목적 거부감이 사회적으로 서서히 사라지기 시작하였다.","{'word': '홍석천', 'start_idx': 24, 'end_idx': 26, 'entity_type': 'PER'}","{'word': '이시연', 'start_idx': 46, 'end_idx': 48, 'entity_type': 'PER'}",no_relation,정준녕,"('홍석천', '이시연')",no_relation,1
888,이승만3_31,"초대 내각을 구성한 장관으로는 외무 장택상, 내무 윤치영, 재무 김도연, 법무 이인, 국방 이범석(겸임), 문교 안호상, 농림 조봉암, 상공 임영신, 사회 전진한, 교통 민희식, 체신 윤석구, 무임소국무위원 이청천(지청천)·이윤영 등이 임명되었다.","{'word': '임영신', 'start_idx': 79, 'end_idx': 81, 'entity_type': 'PER'}","{'word': '초대 내각', 'start_idx': 0, 'end_idx': 4, 'entity_type': 'ORG'}",per:employee_of,정준녕,"('임영신', '초대 내각')",per:employee_of,3
889,문재인_112,"또한 여성가족부 장관 후보자에 진선미 더불어민주당 의원, 고용노동부 장관 후보자에 이재갑 근로복지공단 이사장, 산업통상자원부 장관 후보자에 성윤모 특허청장을 각각 발탁했다.","{'word': '이재갑', 'start_idx': 46, 'end_idx': 48, 'entity_type': 'PER'}","{'word': '근로복지공단 이사장', 'start_idx': 50, 'end_idx': 59, 'entity_type': 'POH'}",per:title,이원재,"('이재갑', '근로복지공단 이사장')",per:title,5
890,대한민국1_60,"고조선 멸망을 전후하여 부여, 옥저, 동예, 진국, 삼한 등 여러 나라가 생겨났고, 이후 고구려, 백제, 신라의 삼국 시대로 이어졌으며 이 중 신라가 삼국을 부분적으로 통일하는 한편 북쪽의 발해와 함께 남북국 시대를 형성했다.","{'word': '백제', 'start_idx': 55, 'end_idx': 56, 'entity_type': 'LOC'}","{'word': '고구려', 'start_idx': 50, 'end_idx': 52, 'entity_type': 'LOC'}",no_relation,이원재,"('백제', '고구려')",no_relation,1
891,대한민국2_38,2012년 제18대 대선에서는 새누리당의 박근혜 후보가 대통령에 당선되었다.,"{'word': '제18대 대선', 'start_idx': 6, 'end_idx': 12, 'entity_type': 'EVT'}","{'word': '2012년', 'start_idx': 0, 'end_idx': 4, 'entity_type': 'DAT'}",event/artifact:date,이정아,"('제18대 대선', '2012년')",event/artifact:date,9
892,박근혜1_21,"이로써 박근혜는 대한민국 최초의 여성 대통령이자 1987년 대한민국 헌법 개정 이후 최초 과반 득표 대통령, 최초 이공계 출신 대통령, 최초 독신 대통령, 최초 부녀 대통령으로 기록되었다.","{'word': '박근혜', 'start_idx': 4, 'end_idx': 6, 'entity_type': 'PER'}","{'word': '대통령', 'start_idx': 18, 'end_idx': 23, 'entity_type': 'POH'}",per:title,이정아,"('박근혜', '대통령')",per:title,5
893,중임_2,"정축(丁丑)년에 왕위에 올랐고 이윤을 재상으로, 박(亳)을 수도로 삼았다.","{'word': '이윤', 'start_idx': 17, 'end_idx': 18, 'entity_type': 'PER'}","{'word': '재상', 'start_idx': 21, 'end_idx': 22, 'entity_type': 'POH'}",per:title,김별희,"('이윤', '재상')",per:title,5
894,이승만3_238,"같은 날인 3월 8일 이승만은 ""김주석 부하에 몇 사람의 무지망동한 범죄로 김주석에게 누가 미치게 한 것은 참으로 통탄할 일이다""라고 말하며 김구의 장덕수 피살 사건 관련설을 믿을 수 없다고 일축하였다.","{'word': '김구', 'start_idx': 79, 'end_idx': 80, 'entity_type': 'PER'}","{'word': '이승만', 'start_idx': 12, 'end_idx': 14, 'entity_type': 'PER'}",no_relation,정준녕,"('김구', '이승만')",no_relation,1
895,대한민국3_19,대한민국과 미국의 관계는 19세기 중반인 1871년 조선의 통상을 요구하던 제너럴셔먼호 사건으로 거슬러 올라간다.,"{'word': '제너럴셔먼호 사건', 'start_idx': 42, 'end_idx': 50, 'entity_type': 'EVT'}","{'word': '1871년', 'start_idx': 23, 'end_idx': 27, 'entity_type': 'DAT'}",event/artifact:date,김별희,"('제너럴셔먼호 사건', '1871년')",event/artifact:date,9
896,이승만3_97,오세창·김창숙·박열·이청천·조만식·이을규(李乙圭) 등 6인을 국무위원에 보선하였다.,"{'word': '이을규', 'start_idx': 19, 'end_idx': 21, 'entity_type': 'PER'}","{'word': '국무위원', 'start_idx': 34, 'end_idx': 37, 'entity_type': 'POH'}",per:title,정준녕,"('이을규', '국무위원')",per:title,5
897,문재인_10,"1965년에 남항초등학교를 졸업한 문재인은 경남중학교에 입학했고, 1968년 중학교를 졸업한 후에는 경남고등학교에 수석 입학했다.","{'word': '문재인', 'start_idx': 19, 'end_idx': 21, 'entity_type': 'PER'}","{'word': '경남고등학교', 'start_idx': 56, 'end_idx': 61, 'entity_type': 'ORG'}",per:employee_of,이원재,"('문재인', '경남고등학교')",per:employee_of,3
898,문재인_224,"본관은 남평(南平). 노무현과 법무법인 부산에서 변호사로 활동했고, 참여정부의 청와대 민정수석과 대통령비서실장을 거쳐 제19대 국회의원과 더불어민주당 대표를 역임했다.","{'word': '노무현', 'start_idx': 12, 'end_idx': 14, 'entity_type': 'PER'}","{'word': '대통령비서실장', 'start_idx': 54, 'end_idx': 60, 'entity_type': 'POH'}",no_relation,이원재,"('노무현', '대통령비서실장')",no_relation,1
899,문재인_127,"임종석 대통령비서실장 후임에는 노영민 주중국대사가, 한병도 정무수석 후임에는 강기정 전 더불어민주당 의원이, 윤영찬 국민소통수석 후임에는 윤도한 전 MBC 논설위원이 각각 내정되었다.","{'word': '임종석', 'start_idx': 0, 'end_idx': 2, 'entity_type': 'PER'}","{'word': '대통령비서실장', 'start_idx': 4, 'end_idx': 10, 'entity_type': 'POH'}",per:title,이원재,"('임종석', '대통령비서실장')",per:title,5
900,국가원수_2,"사회주의 국가의 경우 과거에는 소련과 같이 의회 의장이 국가원수인 경우가 대부분이였고, 현재는 중화인민공화국, 쿠바와 같이 국가주석이 국가원수일 경우가 대부분이다.","{'word': '소련', 'start_idx': 17, 'end_idx': 18, 'entity_type': 'ORG'}","{'word': '쿠바', 'start_idx': 62, 'end_idx': 63, 'entity_type': 'ORG'}",no_relation,이원재,"('소련', '쿠바')",no_relation,1
901,문재인_222,김정은과 트럼프 대통령을 한 자리에 모으는 한국 대통령의 외교 기술을 매우 높게 산다는 이야기도 덧붙였다.,"{'word': '김정은', 'start_idx': 0, 'end_idx': 2, 'entity_type': 'PER'}","{'word': '트럼프', 'start_idx': 5, 'end_idx': 7, 'entity_type': 'PER'}",no_relation,이원재,"('김정은', '트럼프')",no_relation,1
902,윤석열_49,"2021년 6월 29일 대통령 선거 출마를 선언하였고, 7월 30일에는 국민의힘에 입당하였다.","{'word': '대통령 선거', 'start_idx': 13, 'end_idx': 18, 'entity_type': 'EVT'}","{'word': '2021년 6월 29일', 'start_idx': 0, 'end_idx': 11, 'entity_type': 'DAT'}",event/artifact:date,정준녕,"('대통령 선거', '2021년 6월 29일')",event/artifact:date,9
903,헌법_9,법실증주의를 취하고 있는 라반트나 켈젠과 같은 학자는 헌법 개정의 한계를 부인한다.,"{'word': '켈젠', 'start_idx': 19, 'end_idx': 20, 'entity_type': 'PER'}","{'word': '라반트', 'start_idx': 14, 'end_idx': 16, 'entity_type': 'PER'}",no_relation,김별희,"('켈젠', '라반트')",no_relation,1
904,문재인_30,"김상곤 사회부총리 겸 교육부 장관의 후임으로 유은혜 더불어민주당 의원, 송영무 국방부 장관의 후임으로 정경두 합동참모본부 의장을 발탁했다.","{'word': '유은혜', 'start_idx': 25, 'end_idx': 27, 'entity_type': 'PER'}","{'word': '더불어민주당', 'start_idx': 29, 'end_idx': 34, 'entity_type': 'ORG'}",per:employee_of,이원재,"('유은혜', '더불어민주당')",per:employee_of,3
905,이승만3_55,"이승만이 임정법통론을 일시보류한데다가 4월 29일 임시정부 주석 취임까지 거부하자 급기야 5월 2일 경교장에서 이승만, 김구, 조소앙, 조완구, 이청천, 김창숙 등 국민의회 국무위원들과 독촉국민회 지방대표 여러 명이 모여 회담을 하였는데, 이승만의 '임정봉대가 필요할 시기가 올 때까지 보류하자'는 의견과 임시정부 일부요인의 '임정봉대가 필요하다'는 이견을 좁히지 못하였다.","{'word': '이청천', 'start_idx': 81, 'end_idx': 83, 'entity_type': 'PER'}","{'word': '조완구', 'start_idx': 76, 'end_idx': 78, 'entity_type': 'PER'}",per:colleagues,정준녕,"('이청천', '조완구')",per:colleagues,4
906,이승만3_264,"1948년 7월 20일 실시된 제1대 대통령 선거에서 김구, 안재홍, 서재필 등을 누르고 제헌 국회의 대한민국 제1대 대통령으로 선출되었다.","{'word': '김구', 'start_idx': 30, 'end_idx': 31, 'entity_type': 'PER'}","{'word': '대한민국 제1대 대통령', 'start_idx': 57, 'end_idx': 68, 'entity_type': 'POH'}",no_relation,정준녕,"('김구', '대한민국 제1대 대통령')",no_relation,1
907,이승만3_122,이후 이승만은 이범석을 국무총리에 내정하였다.,"{'word': '이범석', 'start_idx': 8, 'end_idx': 10, 'entity_type': 'PER'}","{'word': '국무총리', 'start_idx': 13, 'end_idx': 16, 'entity_type': 'POH'}",per:title,정준녕,"('이범석', '국무총리')",per:title,5
908,대한민국4_9,"대한민국의 도시철도는 수도권과 동남권, 대구광역시, 대전광역시, 광주광역시 등에서 운행되고 있다.","{'word': '대한민국', 'start_idx': 0, 'end_idx': 3, 'entity_type': 'LOC'}","{'word': '동남권', 'start_idx': 17, 'end_idx': 19, 'entity_type': 'LOC'}",loc:subordinate,정준녕,"('대한민국', '동남권')",loc:subordinate,8
909,문재인_37,"동기였던 박원순, 고승덕, 조영래 사이에서 1등을 했으나 학생운동 전력 때문에 성적이 차석으로 밀렸다는 이야기가 있지만, 이는 검증되지 않았다는 의혹도 존재한다.","{'word': '박원순', 'start_idx': 5, 'end_idx': 7, 'entity_type': 'PER'}","{'word': '조영래', 'start_idx': 15, 'end_idx': 17, 'entity_type': 'PER'}",per:colleagues,이원재,"('박원순', '조영래')",per:colleagues,4
910,대한민국4_23,"1998년 5월 17일에는 성소수자 인권 운동가 오세인이 1997년 자신이 게이임을 가족에게 밝혔다가 추방당한 후, 활동하던 단체 사무실에서 자살하였고, 2003년 4월 26일에는 동성애자를 악마, 사탄 등으로 비판하는 개신교계의 공격과 동성애를 청소년 유해 단어, 음란물로 지정하려는 움직임 등 성소수자 혐오에 저항하는 활동을 하는 시인 겸 작가 육우당이 끝내 자살하게 되는 사건이 있었다.","{'word': '오세인', 'start_idx': 27, 'end_idx': 29, 'entity_type': 'PER'}","{'word': '1998년 5월 17일', 'start_idx': 0, 'end_idx': 11, 'entity_type': 'DAT'}",no_relation,정준녕,"('오세인', '1998년 5월 17일')",no_relation,1
911,문재인_253,"3기 신도시의 위치는 분당, 일산 등 1기 신도시와 서울시 사이가 될 것이라고 설명했다.","{'word': '3기 신도시', 'start_idx': 0, 'end_idx': 5, 'entity_type': 'LOC'}","{'word': '분당', 'start_idx': 12, 'end_idx': 13, 'entity_type': 'LOC'}",no_relation,이원재,"('3기 신도시', '분당')",no_relation,1
912,문재인_53,문재인은 특수 훈련에서의 우수한 평가 결과로 인해 특전사 복무 중 당시 특전사령관 정병주와 공수여단장 전두환으로부터 두 차례의 최우수 특전사 표창을 수상하기도 했다.,"{'word': '정병주', 'start_idx': 46, 'end_idx': 48, 'entity_type': 'PER'}","{'word': '특전사령관', 'start_idx': 40, 'end_idx': 44, 'entity_type': 'POH'}",per:title,이원재,"('정병주', '특전사령관')",per:title,5
913,이승만3_33,"초대 내각을 구성한 장관으로는 외무 장택상, 내무 윤치영, 재무 김도연, 법무 이인, 국방 이범석(겸임), 문교 안호상, 농림 조봉암, 상공 임영신, 사회 전진한, 교통 민희식, 체신 윤석구, 무임소국무위원 이청천(지청천)·이윤영 등이 임명되었다.","{'word': '민희식', 'start_idx': 95, 'end_idx': 97, 'entity_type': 'PER'}","{'word': '초대 내각', 'start_idx': 0, 'end_idx': 4, 'entity_type': 'ORG'}",per:employee_of,정준녕,"('민희식', '초대 내각')",per:employee_of,3
914,이승만3_135,"초대 내각을 구성한 장관으로는 외무 장택상, 내무 윤치영, 재무 김도연, 법무 이인, 국방 이범석(겸임), 문교 안호상, 농림 조봉암, 상공 임영신, 사회 전진한, 교통 민희식, 체신 윤석구, 무임소국무위원 이청천(지청천)·이윤영 등이 임명되었다.","{'word': '이윤영', 'start_idx': 125, 'end_idx': 127, 'entity_type': 'PER'}","{'word': '장관', 'start_idx': 11, 'end_idx': 12, 'entity_type': 'POH'}",per:title,정준녕,"('이윤영', '장관')",per:title,5
915,대한민국1_14,"중화인민공화국, 중화민국, 일본, 베트남 등 주로 동아시아에 있는 한자 문화권 국가들에서도 일상에서 대한민국을 간단히 한국(, , )이라 부른다.","{'word': '동아시아', 'start_idx': 28, 'end_idx': 31, 'entity_type': 'LOC'}","{'word': '일본', 'start_idx': 15, 'end_idx': 16, 'entity_type': 'LOC'}",loc:subordinate,이원재,"('동아시아', '일본')",loc:subordinate,8
916,이승만3_60,"이승만이 임정법통론을 일시보류한데다가 4월 29일 임시정부 주석 취임까지 거부하자 급기야 5월 2일 경교장에서 이승만, 김구, 조소앙, 조완구, 이청천, 김창숙 등 국민의회 국무위원들과 독촉국민회 지방대표 여러 명이 모여 회담을 하였는데, 이승만의 '임정봉대가 필요할 시기가 올 때까지 보류하자'는 의견과 임시정부 일부요인의 '임정봉대가 필요하다'는 이견을 좁히지 못하였다.","{'word': '조소앙', 'start_idx': 71, 'end_idx': 73, 'entity_type': 'PER'}","{'word': '이청천', 'start_idx': 81, 'end_idx': 83, 'entity_type': 'PER'}",per:colleagues,정준녕,"('조소앙', '이청천')",per:colleagues,4
917,박정희_25,재미 언론가 문명자의 1999년 저서 《내가 본 박정희와 김대중》에서는 “만주국육군군관학교 시절 박정희의 창씨명은 다카키 마사오. 그곳을 졸업하고 일본 육군사관학교에 편입했을 때 박정희는 창씨명을 완전히 일본사람 이름처럼 보이는 오카모토 미노루로 바꾼다.”라고 서술하며 2005년 도쿄대학교에서 출판한 《일본 육·해군 종합사전》 2판에서 박정희가 '오카모토 미노루'로 소개되는 것을 근거로 제시한다.,"{'word': '문명자', 'start_idx': 7, 'end_idx': 9, 'entity_type': 'PER'}","{'word': '재미 언론가', 'start_idx': 0, 'end_idx': 5, 'entity_type': 'POH'}",per:title,이정아,"('문명자', '재미 언론가')",per:title,5
918,문재인_5,문용형은 함경남도 흥남의 남평 문씨 집성촌인 솔안마을 출신으로 함흥농고 졸업 후 일제시대 흥남읍사무소에서 농업계 계장으로 근무했다.,"{'word': '문용형', 'start_idx': 0, 'end_idx': 2, 'entity_type': 'PER'}","{'word': '흥남읍사무소', 'start_idx': 50, 'end_idx': 55, 'entity_type': 'ORG'}",per:employee_of,이원재,"('문용형', '흥남읍사무소')",per:employee_of,3
919,이승만3_278,1945년 10월 16일 오후 허정은 미 군정 당국의 연락을 받고 이승만이 여장을 푼 조선호텔로 찾아갔다.,"{'word': '허정', 'start_idx': 17, 'end_idx': 18, 'entity_type': 'PER'}","{'word': '1945년 10월 16일', 'start_idx': 0, 'end_idx': 12, 'entity_type': 'DAT'}",no_relation,정준녕,"('허정', '1945년 10월 16일')",no_relation,1
920,박근혜2_10,참고로 박근혜는 지난 18대 대한민국 국회 환경노동위원회 위원이었다.,"{'word': '박근혜', 'start_idx': 4, 'end_idx': 6, 'entity_type': 'PER'}","{'word': '18대 대한민국 국회 환경노동위원회 위원', 'start_idx': 12, 'end_idx': 33, 'entity_type': 'POH'}",per:title,김별희,"('박근혜', '18대 대한민국 국회 환경노동위원회 위원')",per:title,5
921,박정희_22,"다채로운 논란들에 끊임없이 연관되어온 가로세로연구소 소장 강용석 변호사, '일간베스트' 회원 강씨, 그리고 정미홍 전 KBS 아나운서는 각자 박정희의 혈서가 날조라는 주장을 하며 민족문제연구소가 박 대통령 혈서 관련 기사를 조작했다는 취지의 주장을 펼쳐왔다.","{'word': '박', 'start_idx': 109, 'end_idx': 109, 'entity_type': 'PER'}","{'word': '대통령', 'start_idx': 111, 'end_idx': 113, 'entity_type': 'POH'}",per:title,이정아,"('박', '대통령')",per:title,5
922,박정희_4,"인터넷 일간지 오마이뉴스의 정운현 기자는 ""박정희가 배속된 23사단 72연대 연대장 이름이 오카모토였다는 김병태 교수의 주장은 허구성이 있다.","{'word': '정운현', 'start_idx': 15, 'end_idx': 17, 'entity_type': 'PER'}","{'word': '오마이뉴스', 'start_idx': 8, 'end_idx': 12, 'entity_type': 'ORG'}",per:employee_of,이정아,"('정운현', '오마이뉴스')",per:employee_of,3
923,한반도_9,"이후 후고구려의 장수였던 왕건이 다른 호족 세력들과 함께 궁예를 축출하였고, 고려를 건국하였다.","{'word': '왕건', 'start_idx': 14, 'end_idx': 15, 'entity_type': 'PER'}","{'word': '장수', 'start_idx': 9, 'end_idx': 10, 'entity_type': 'POH'}",per:title,김별희,"('왕건', '장수')",per:title,5
924,박근혜1_6,"이후 박근혜와 최태민은 함께 1989년 육영수를 추모하는 단체인 근화봉사단을 조직하였고, 박정희와 육영수를 추모하는 월간 신문인 근화보도 발행하였다.","{'word': '최태민', 'start_idx': 8, 'end_idx': 10, 'entity_type': 'PER'}","{'word': '근화봉사단', 'start_idx': 36, 'end_idx': 40, 'entity_type': 'ORG'}",per:employee_of,이정아,"('최태민', '근화봉사단')",per:employee_of,3
925,문재인_257,이 외에도 동의대학교 사건에서도 변호인단을 꾸려 재판을 진두지휘했으며 2002년에는 1980년 가족 간첩단 사건에 연루되어 15년을 복역하고 출소한 신귀영 씨의 재심에 변호인단으로 참여하기도 했다.,"{'word': '1980년 가족 간첩단 사건', 'start_idx': 47, 'end_idx': 61, 'entity_type': 'EVT'}","{'word': '2002년', 'start_idx': 39, 'end_idx': 43, 'entity_type': 'DAT'}",no_relation,이원재,"('1980년 가족 간첩단 사건', '2002년')",no_relation,1
926,대한민국5_10,"대표적인 K-POP 가수로는 보아, 동방신기, 슈퍼주니어, 소녀시대, 샤이니, 비스트, 티아라, 인피니트, 방탄소년단, 핑클 등이 있다.","{'word': '비스트', 'start_idx': 44, 'end_idx': 46, 'entity_type': 'PER'}","{'word': '가수', 'start_idx': 11, 'end_idx': 12, 'entity_type': 'POH'}",per:title,임성근,"('비스트', '가수')",per:title,5
