,id,sentence,subject_entity,object_entity,label,annotator,pair,label_,label_num
0,이승만3_143,12월 20일 유엔 한국 임시위원단을 맞이할 한국민족대표단에서 이승만과 김구가 공동고문으로 추대되었다.,"{'word': '김구', 'start_idx': 40, 'end_idx': 41, 'entity_type': 'PER'}","{'word': '12월 20일', 'start_idx': 0, 'end_idx': 6, 'entity_type': 'DAT'}",per:inauguration/removal_date,정준녕,"('김구', '12월 20일')",per:inauguration/removal_date,6
1,대한민국4_16,"국채 보상 운동이 자발적으로 확산되었고 1920년대에는 김성수는 자본을 투자하여 경성방직, 경성직류 등 방직과 면 공업을 육성하여 민족자본을 형성하기도 하였다.","{'word': '김성수', 'start_idx': 31, 'end_idx': 33, 'entity_type': 'PER'}","{'word': '1920년', 'start_idx': 22, 'end_idx': 26, 'entity_type': 'DAT'}",no_relation,정준녕,"('김성수', '1920년')",no_relation,1
2,대한민국1_53,백두산에는 시베리아나 만주에서만 볼 수 있는 침엽수림과 같은 북방계 식물류가 자란다.,"{'word': '시베리아', 'start_idx': 6, 'end_idx': 9, 'entity_type': 'LOC'}","{'word': '백두산', 'start_idx': 0, 'end_idx': 2, 'entity_type': 'LOC'}",no_relation,이원재,"('시베리아', '백두산')",no_relation,1
3,문재인_68,"6월 15일 새 총리 후보로 문창극이 지명되자 ""국민도 불행하고 박근혜 정부에도 불행한 길""이라고 강력히 비판했다.","{'word': '문창극', 'start_idx': 16, 'end_idx': 18, 'entity_type': 'PER'}","{'word': '총리 후보', 'start_idx': 9, 'end_idx': 13, 'entity_type': 'POH'}",per:title,이원재,"('문창극', '총리 후보')",per:title,5
4,대한민국2_48,"2016년 제20대 총선에서 여소야대 국면에 처하면서 정치적 난관에 처한 박근혜 정부는, 같은해 10월 민간인 신분인 최순실 씨의 국정 농단 사태가 폭로됨에 따라 박근혜 대통령 퇴진 운동이 시작되었고, 국회가 박근혜 대통령 탄핵 소추안을 가결시키며 박근혜 대통령의 권한이 정지, 황교안 대통령 권한대행 체제가 확립되었다.","{'word': '황교안', 'start_idx': 156, 'end_idx': 158, 'entity_type': 'PER'}","{'word': '박근혜', 'start_idx': 139, 'end_idx': 141, 'entity_type': 'PER'}",no_relation,이정아,"('황교안', '박근혜')",no_relation,1
5,이승만3_184,"이승만은 친히 김포비행장으로 나가 김구, 김규식 등 환국 요인들을 영접하였다.","{'word': '이승만', 'start_idx': 0, 'end_idx': 2, 'entity_type': 'PER'}","{'word': '김규식', 'start_idx': 23, 'end_idx': 25, 'entity_type': 'PER'}",no_relation,정준녕,"('이승만', '김규식')",no_relation,1
6,한반도_56,"북쪽으로는 요동반도와 평행한 방향으로 뻗은 평남 분지, 두만 분지, 관모봉 분지, 단천 습곡대, 낭림 분지가 펼쳐지며, 남쪽으로는 옥천대(沃川帶)를 사이에 두고 경기 육괴, 영남 육괴와 경상 분지로 이루어진다.","{'word': '관모봉 분지', 'start_idx': 38, 'end_idx': 43, 'entity_type': 'LOC'}","{'word': '평남 분지', 'start_idx': 24, 'end_idx': 28, 'entity_type': 'LOC'}",no_relation,김별희,"('관모봉 분지', '평남 분지')",no_relation,1
7,박정희_59,"또한 만주신문 자료에는 박정희의 군관지원 편지와 함께 一死以テ御奉公 朴正熙(이시이 테 오호코, 또는 일사이 테 어봉공, 박정희)라고 쓰여있는 혈서 내용이 함께 동봉되어 있었다고 기록한다.","{'word': '박정희', 'start_idx': 13, 'end_idx': 15, 'entity_type': 'PER'}","{'word': '만주신문', 'start_idx': 3, 'end_idx': 6, 'entity_type': 'ORG'}",no_relation,이정아,"('박정희', '만주신문')",no_relation,1
8,정부_0,"독일의 포르슈토프(Forstoff) 교수는 행정은 추사(beschreiben)할 수 있지만, 정의(定義, definieren)는 할 수 없다고 하였다.","{'word': '포르슈토프', 'start_idx': 4, 'end_idx': 8, 'entity_type': 'PER'}","{'word': '교수', 'start_idx': 20, 'end_idx': 21, 'entity_type': 'POH'}",per:title,정준녕,"('포르슈토프', '교수')",per:title,5
9,이승만3_192,"윤보선의 사회로 시작되어 오세창의 개회사, 이인의 봉영문 낭독, 권동진의 만세삼창이 이어진 뒤 봉영문은 권동진, 김성수, 이인을 통해 김구에게 전달되었다.","{'word': '윤보선', 'start_idx': 0, 'end_idx': 2, 'entity_type': 'PER'}","{'word': '김구', 'start_idx': 75, 'end_idx': 76, 'entity_type': 'PER'}",no_relation,정준녕,"('윤보선', '김구')",no_relation,1
10,한반도_23,"지금까지 실시된 대규모 간척사업 중 대표적인 것은 전북 군산시(舊옥구군) 일대, 부안군 계화도(界火島) 일대, 전남 진도의 소포리(素浦里) 일대 등지에서 완공된 것들이다.","{'word': '전북', 'start_idx': 28, 'end_idx': 29, 'entity_type': 'LOC'}","{'word': '군산시', 'start_idx': 31, 'end_idx': 33, 'entity_type': 'LOC'}",loc:subordinate,김별희,"('전북', '군산시')",loc:subordinate,8
11,박정희_63,"그리고 1962년 7월 14일, 개인재산을 기부하여 장학재단인 5·16 장학회를 설립 하였다고 ‘박정희 기념사업회’는 밝히고 있으나 ‘국가정보원 과거사건 진실규명을 통한 발전위원회’가 밝힌 바에 의하면, 당시 국가재건최고회의 의장이었던 박정희가 중앙정보부에 지시하여 '부정축재처리요강'에 의해 이병철 등 기업인 15명과 함께 구속되어 있던 부산 지역의 재력가 김지태(金智泰)를 석방하는 조건으로 부산일보, 한국문화방송, 부산문화방송의 주식과 부일장학회 기본재산 명목의 토지 100,147평을 헌납토록 하였고, 이 재산 중 토지는 국방부에 무상으로 양도하였으며 이후 ""기부받은 재산이 자꾸 유실된다""는 보고를 받고 법무부 장관 고원증에게 장학회의 설립을 지시하여 5·16 장학회를 설립했다.","{'word': '김지태', 'start_idx': 201, 'end_idx': 203, 'entity_type': 'PER'}","{'word': '부산일보', 'start_idx': 221, 'end_idx': 224, 'entity_type': 'ORG'}",no_relation,이정아,"('김지태', '부산일보')",no_relation,1
12,문재인_136,다음날 후임으로 윤석열이 대통령으로 취임했다.,"{'word': '윤석열', 'start_idx': 9, 'end_idx': 11, 'entity_type': 'PER'}","{'word': '대통령', 'start_idx': 14, 'end_idx': 16, 'entity_type': 'POH'}",per:title,이원재,"('윤석열', '대통령')",per:title,5
13,윤석열_30,서울대학교 출신으로는 김영삼 대통령 이후 두 번째이다.,"{'word': '김영삼', 'start_idx': 12, 'end_idx': 14, 'entity_type': 'PER'}","{'word': '대통령', 'start_idx': 16, 'end_idx': 18, 'entity_type': 'POH'}",per:title,정준녕,"('김영삼', '대통령')",per:title,5
14,박정희_72,"박정희가 1938년 5월 중순에 편지를 보냈고, 보름 정도의 운송기간 뒤 만주지역의 신문에 박정희 이야기가 실렸다면, 같은해 5월 또는 6월, 길게 잡아도 7월 초에는 도착했을 시간이다.","{'word': '박정희', 'start_idx': 51, 'end_idx': 53, 'entity_type': 'PER'}","{'word': '만주지역', 'start_idx': 41, 'end_idx': 44, 'entity_type': 'LOC'}",no_relation,이정아,"('박정희', '만주지역')",no_relation,1
15,윤석열_8,"윤석열(尹錫悅, 윤서결, 1960년 12월 18일~)은 대한민국의 제20대 대통령이다.","{'word': '윤석열', 'start_idx': 0, 'end_idx': 2, 'entity_type': 'PER'}","{'word': '대한민국의 제20대 대통령', 'start_idx': 31, 'end_idx': 44, 'entity_type': 'POH'}",per:title,정준녕,"('윤석열', '대한민국의 제20대 대통령')",per:origin,7
16,박근혜2_11,"전태일의 여동생이자 민주통합당 국회의원인 전순옥은 진정으로 전태일 정신을 생각한다면 쌍용차나 용산참사 희생자 등 고통 당하는 사람들을 먼저 찾았어야 한다고 말하고, 이른바 국민대통합에 대해서도, 정책적으로 접근을 하거나 현안이 일어나는 현장을 먼저 찾아가 문제를 어떻게 해결할 것인가를 이야기하며 희망을 줘야 한다고 말했다.","{'word': '전순옥', 'start_idx': 23, 'end_idx': 25, 'entity_type': 'PER'}","{'word': '민주통합당 국회의원', 'start_idx': 11, 'end_idx': 20, 'entity_type': 'POH'}",per:title,김별희,"('전순옥', '민주통합당 국회의원')",per:employee_of,3
17,윤석열_5,수사 도중 국가정보원 직원들의 대대적인 트위터 활동과 관련한 결정적인 증거를 포착하고 국가정보원 직원들에 대한 체포와 압수수색을 집행하였는데 서울중앙지방검찰청 조영곤 검사장에게 보고했지만 동의받지 못하자 자신의 책임으로 체포를 강행하였다.,"{'word': '조영곤', 'start_idx': 89, 'end_idx': 91, 'entity_type': 'PER'}","{'word': '서울중앙지방검찰청', 'start_idx': 79, 'end_idx': 87, 'entity_type': 'ORG'}",per:employee_of,정준녕,"('조영곤', '서울중앙지방검찰청')",per:employee_of,3
18,이승만3_314,"한편 1월 16일 서울로부터 '전국학련 산하의 학생들이 1월 18일 반탁데모를 전개시키고자 계획하고 있다'는 전보를 받은 이승만은 ""조선에는 여하한 데모도 전개되지 않아야 한다.","{'word': '이승만', 'start_idx': 68, 'end_idx': 70, 'entity_type': 'PER'}","{'word': '1월 18일', 'start_idx': 31, 'end_idx': 36, 'entity_type': 'DAT'}",no_relation,정준녕,"('이승만', '1월 18일')",no_relation,1
19,대한민국4_28,"한편, 보수 기독교단체에서 ""동성애가 합법화되면 동성애자를 욕해도 처벌받는다거나 동성애자 부부에 대해 주례를 거부한 이유로 처벌받을 수 있다""라고 주장하며 제17대 국회에서부터 대한민국 차별금지법 제정에 대한 반대를 예배나 각종 집회를 통해 선동하였고 또, 자유한국당 안상수 의원은 2019년 11월 ""국가인권위원회법에서 정한 차별금지 대상에서 성적 취향을 제외하자""는 개정안을 발의하며 논란을 낳았다.","{'word': '안상수', 'start_idx': 150, 'end_idx': 152, 'entity_type': 'PER'}","{'word': '2019년 11월', 'start_idx': 158, 'end_idx': 166, 'entity_type': 'DAT'}",no_relation,정준녕,"('안상수', '2019년 11월')",no_relation,1
20,대한민국3_20,그러나 이러한 관계는 1905년 을사조약 뒤부터 뒤틀어졌는데 당시 미국 제26대 대통령 시어도어 루스벨트의 딸인 엘리스 루스벨트가 미국을 대표하여 대한제국에 방문했을 때 고종의 환대에도 없는 사람 취급하였고 고종의 아내였던 명성황후 무덤 앞의 말 조각상에서 앉아 사진을 찍는 무례함을 범했기 때문이다.,"{'word': '을사조약', 'start_idx': 18, 'end_idx': 21, 'entity_type': 'EVT'}","{'word': '1905년', 'start_idx': 12, 'end_idx': 16, 'entity_type': 'DAT'}",event/artifact:date,김별희,"('을사조약', '1905년')",event/artifact:date,9
21,대한민국5_6,"대표적인 K-POP 가수로는 보아, 동방신기, 슈퍼주니어, 소녀시대, 샤이니, 비스트, 티아라, 인피니트, 방탄소년단, 핑클 등이 있다.","{'word': '동방신기', 'start_idx': 20, 'end_idx': 23, 'entity_type': 'PER'}","{'word': '가수', 'start_idx': 11, 'end_idx': 12, 'entity_type': 'POH'}",per:title,임성근,"('동방신기', '가수')",per:title,5
22,문재인_210,문재인 측은 국가정보원에서 자신을 비방하는 여론조작을 벌인다고 12월 11일 공개하였다.,"{'word': '문재인', 'start_idx': 0, 'end_idx': 2, 'entity_type': 'PER'}","{'word': '국가정보원', 'start_idx': 7, 'end_idx': 11, 'entity_type': 'ORG'}",no_relation,이원재,"('문재인', '국가정보원')",no_relation,1
23,문재인_235,"국정원장으로는 서훈이, 청와대 경호실장으로는 주영훈이 내정되었다.","{'word': '서훈', 'start_idx': 8, 'end_idx': 9, 'entity_type': 'PER'}","{'word': '국정원장', 'start_idx': 0, 'end_idx': 3, 'entity_type': 'POH'}",no_relation,이원재,"('서훈', '국정원장')",per:title,5
24,문재인_236,"국정원장으로는 서훈이, 청와대 경호실장으로는 주영훈이 내정되었다.","{'word': '주영훈', 'start_idx': 25, 'end_idx': 27, 'entity_type': 'PER'}","{'word': '청와대 경호실장', 'start_idx': 13, 'end_idx': 20, 'entity_type': 'POH'}",no_relation,이원재,"('주영훈', '청와대 경호실장')",per:title,5
25,문재인_116,"또한 백운규 산업통상자원부 장관은 탈원전 정책으로, 김영주 고용노동부 장관은 '고용 쇼크'로 논란을 빚었다.","{'word': '백운규', 'start_idx': 3, 'end_idx': 5, 'entity_type': 'PER'}","{'word': '산업통상자원부 장관', 'start_idx': 7, 'end_idx': 16, 'entity_type': 'POH'}",per:title,이원재,"('백운규', '산업통상자원부 장관')",per:title,5
26,문재인_247,"문재인 대통령은 남북정상회담을 할 것이라고 시사했으며, 여건이 된다면 평양도 갈 것이라고 밝혔다.","{'word': '문재인', 'start_idx': 0, 'end_idx': 2, 'entity_type': 'PER'}","{'word': '평양', 'start_idx': 39, 'end_idx': 40, 'entity_type': 'LOC'}",no_relation,이원재,"('문재인', '평양')",no_relation,1
27,문재인_59,"문재인은 노무현의 당선 이후 변호사 업무에 복귀하려 했으나, 당선 직후 노무현의 민정수석비서관 제의를 받고 ""정치하라고 하지 마라, 그리고 민정수석으로 끝내겠다""는 2가지 조건을 내걸고 민정수석비서관직을 수락하였다.","{'word': '문재인', 'start_idx': 0, 'end_idx': 2, 'entity_type': 'PER'}","{'word': '민정수석', 'start_idx': 78, 'end_idx': 81, 'entity_type': 'POH'}",per:title,이원재,"('문재인', '민정수석')",no_relation,1
28,대한민국5_27,"라디오 방송의 경우 지상파 방송사인 KBS, MBC, SBS, EBS가 점유하는 주파수와 기타 CBS (대한민국의 방송사)(CBS), 극동방송(FEBC), 불교방송(BBS), 평화방송(PBC), 원음방송(WBS) 등 종교방송의 주파수, 교통안내 전문 방송인 교통방송(서울은 TBS, 기타 지역은 TBN 한국교통방송), 국악 전문의 국악방송, 그리고 국방홍보 목적의 국군방송 등의 여러 방송사가 존재한다.","{'word': 'SBS', 'start_idx': 30, 'end_idx': 32, 'entity_type': 'ORG'}","{'word': 'BBS', 'start_idx': 92, 'end_idx': 94, 'entity_type': 'ORG'}",no_relation,임성근,"('SBS', 'BBS')",no_relation,1
29,대한민국5_15,한편 백남준은 독창적인 비디오 아트를 선보여 한국 출신 작가 중 가장 전 세계적으로 잘 알려진 예술가가 되었다. 하지만 한국 순수미술 분야는 국내외적으로 관심을 받지 못하고 있다.,"{'word': '백남준', 'start_idx': 3, 'end_idx': 5, 'entity_type': 'PER'}","{'word': '작가', 'start_idx': 31, 'end_idx': 32, 'entity_type': 'POH'}",per:title,임성근,"('백남준', '작가')",per:title,5
30,박근혜1_67,"박근혜는 2013년 4월 21일 시진핑 중국 국가주석에게 쓰촨성 대지진에 관하여 ""쓰촨성에서 20일 발생한 지진으로 인해 많은 인명 및 재산 피해가 발생했다는 소식을 접하고, 저와 대한민국 국민들은 매우 가슴 아프게 생각하고 있다""라는 내용의 위로전문을 보냈다.","{'word': '쓰촨성 대지진', 'start_idx': 32, 'end_idx': 38, 'entity_type': 'EVT'}","{'word': '2013년 4월 21일', 'start_idx': 5, 'end_idx': 16, 'entity_type': 'DAT'}",no_relation,이정아,"('쓰촨성 대지진', '2013년 4월 21일')",event/artifact:date,9
31,문재인_230,"이후, 8월 25일부터 9월 16일까지 열린 국민참여경선에서 손학규, 김두관, 정세균과 겨루어 전국 순회경선 13회 전승을 거두며 민주통합당의 제18대 대통령 선거 후보로 선출되었다.","{'word': '손학규', 'start_idx': 34, 'end_idx': 36, 'entity_type': 'PER'}","{'word': '제18대 대통령 선거 후보', 'start_idx': 80, 'end_idx': 93, 'entity_type': 'POH'}",no_relation,이원재,"('손학규', '제18대 대통령 선거 후보')",no_relation,1
32,이승만3_159,"이에 전국학련은 기존 계획이었던 매국노소탕대회, 반탁의 재계몽운동, 학생운동사 보고대회, 반탁웅변대회 등을 전면 수정하고, 1월 18일 오후 2시 경운동 천도교강당에서 '반탁학생투쟁사 발표대회'만을 가졌다.","{'word': '반탁학생투쟁사 발표대회', 'start_idx': 95, 'end_idx': 106, 'entity_type': 'EVT'}","{'word': '1월 18일 오후 2시', 'start_idx': 69, 'end_idx': 80, 'entity_type': 'DAT'}",event/artifact:date,정준녕,"('반탁학생투쟁사 발표대회', '1월 18일 오후 2시')",event/artifact:date,9
33,이승만3_263,"이승만이 임정법통론을 일시보류한데다가 4월 29일 임시정부 주석 취임까지 거부하자 급기야 5월 2일 경교장에서 이승만, 김구, 조소앙, 조완구, 이청천, 김창숙 등 국민의회 국무위원들과 독촉국민회 지방대표 여러 명이 모여 회담을 하였는데, 이승만의 '임정봉대가 필요할 시기가 올 때까지 보류하자'는 의견과 임시정부 일부요인의 '임정봉대가 필요하다'는 이견을 좁히지 못하였다.","{'word': '이승만', 'start_idx': 0, 'end_idx': 2, 'entity_type': 'PER'}","{'word': '임시정부 주석', 'start_idx': 28, 'end_idx': 34, 'entity_type': 'POH'}",no_relation,정준녕,"('이승만', '임시정부 주석')",no_relation,1
34,이승만3_108,"그러나 유엔 한국 임시위원단 단장인 크리슈나 메논이 남북한 동시 총선거를 요구하는 발언을 시작하자, 연설 중 즉각 대회장을 박차고 퇴장하였다.","{'word': '크리슈나 메논', 'start_idx': 20, 'end_idx': 26, 'entity_type': 'PER'}","{'word': '유엔 한국 임시위원단 단장', 'start_idx': 4, 'end_idx': 17, 'entity_type': 'POH'}",per:title,정준녕,"('크리슈나 메논', '유엔 한국 임시위원단 단장')",per:title,5
35,국가장_0,국가장(國家葬)은 「국가장법」(일부개정 법률 제14839호 2017년 7월 26일)에 따라 대한민국 정부가 공식 주관하는 장례 의전이다.,"{'word': '법률 제14839호', 'start_idx': 22, 'end_idx': 31, 'entity_type': 'POH'}","{'word': '2017년 7월 26일', 'start_idx': 33, 'end_idx': 44, 'entity_type': 'DAT'}",event/artifact:date,이원재,"('법률 제14839호', '2017년 7월 26일')",event/artifact:date,9
36,이승만3_111,1948년 3월 8일 미국 군율재판 위원회는 북미합중국대통령 트루만의 명의로 1948년 3월 12일 오전 9시에 출정하라는 소환장을 김구에게 발부 하였다.,"{'word': '트루만', 'start_idx': 34, 'end_idx': 36, 'entity_type': 'PER'}","{'word': '북미합중국대통령', 'start_idx': 25, 'end_idx': 32, 'entity_type': 'POH'}",per:title,정준녕,"('트루만', '북미합중국대통령')",per:title,5
37,윤석열_64,"2020년 11월 24일 추미애 법무부 장관에 의해 검찰총장 직무가 정지되었으나, 법원의 집행정지 인용으로 12월 1일 직무에 복귀했다.","{'word': '추미애', 'start_idx': 14, 'end_idx': 16, 'entity_type': 'PER'}","{'word': '2020년 11월 24일', 'start_idx': 0, 'end_idx': 12, 'entity_type': 'DAT'}",no_relation,정준녕,"('추미애', '2020년 11월 24일')",no_relation,1
38,박근혜2_5,법학교수 출신인 새누리당의 이상돈 전 비상대책위원장도 박근혜의 발언이 잘못이라고 지적했다.,"{'word': '이상돈', 'start_idx': 15, 'end_idx': 17, 'entity_type': 'PER'}","{'word': '새누리당', 'start_idx': 9, 'end_idx': 12, 'entity_type': 'ORG'}",per:employee_of,김별희,"('이상돈', '새누리당')",per:employee_of,3
39,박근혜2_27,"이에 박근혜는 과거사 정리위원회의 권고를 무시한 채, ""공익법인화한 정수장학회를 다시 사회환원하라는 것은 정치 공세""라고 반박하였다. 하지만 이런 발언에 대해 '그렇다면 그들 주장대로 공익법인인 육영재단을 두고, 박근혜의 형제들끼리 싸우는 이유가 무엇이냐'며 박근혜의 인식과 그 가족의 행태에 대한 비판도 끊이지 않고 있다.","{'word': '과거사 정리위원회', 'start_idx': 8, 'end_idx': 16, 'entity_type': 'ORG'}","{'word': '박근혜', 'start_idx': 3, 'end_idx': 5, 'entity_type': 'PER'}",no_relation,김별희,"('과거사 정리위원회', '박근혜')",no_relation,1
40,대한민국1_18,태백산맥의 대표적인 산이 설악산이다.,"{'word': '태백산맥', 'start_idx': 0, 'end_idx': 3, 'entity_type': 'LOC'}","{'word': '설악산', 'start_idx': 14, 'end_idx': 16, 'entity_type': 'LOC'}",loc:subordinate,이원재,"('태백산맥', '설악산')",loc:subordinate,8
41,이승만3_107,12월 20일 유엔 한국 임시위원단을 맞이할 한국민족대표단에서 이승만과 김구가 공동고문으로 추대되었다.,"{'word': '김구', 'start_idx': 40, 'end_idx': 41, 'entity_type': 'PER'}","{'word': '공동고문', 'start_idx': 44, 'end_idx': 47, 'entity_type': 'POH'}",per:title,정준녕,"('김구', '공동고문')",per:title,5
42,윤석열_45,2020년 8월 신임 검사 임관식에서 “자유민주주의는 민주주의라는 허울을 쓰고 있는 독재와 전체주의를 배격하는 진짜 민주주의를 말하는 것”이라고 하면서 자유민주주의에 대한 입장을 밝혔다.,"{'word': '신임 검사 임관식', 'start_idx': 9, 'end_idx': 17, 'entity_type': 'POH'}","{'word': '2020년 8월', 'start_idx': 0, 'end_idx': 7, 'entity_type': 'DAT'}",event/artifact:date,정준녕,"('신임 검사 임관식', '2020년 8월')",event/artifact:date,9
43,박근혜1_43,아버지 박정희는 1917년 경상북도 선산군 구미면 상모리(현재의 경상북도 구미시 상모동)에서 소작농 박성빈과 부인 백남의의 5남 2녀 중 막내로 태어났다.,"{'word': '박정희', 'start_idx': 4, 'end_idx': 6, 'entity_type': 'PER'}","{'word': '경상북도 선산군 구미면 상모리', 'start_idx': 15, 'end_idx': 30, 'entity_type': 'LOC'}",per:origin,이정아,"('박정희', '경상북도 선산군 구미면 상모리')",per:origin,7
44,이승만3_168,"대한민국 정부수립 선포 직전인 8월 11일 파리 유엔 총회에서 대한민국의 국제적 승인을 얻기 위해 장면 등을 대표로 지목, 한국대표단을 파견하였다.","{'word': '파리 유엔 총회', 'start_idx': 24, 'end_idx': 31, 'entity_type': 'EVT'}","{'word': '8월 11일', 'start_idx': 17, 'end_idx': 22, 'entity_type': 'DAT'}",event/artifact:date,정준녕,"('파리 유엔 총회', '8월 11일')",event/artifact:date,9
45,윤석열_0,"2019년 7월 검찰총장 취임사에서 “이제는 자유민주주의와 시장경제 질서의 본질을 지키는 데 역량을 더 집중시켜야 한다”고 강조하면서 대검찰청 대변인실을 통해 “신임 총장은 시카고학파인 밀턴 프리드먼과 1947년 스위스에서 자유주의 학자들의 모임인 몽펠르랭소사이어티(MPS)를 결성해 자유주의 가치를 지키고 확산하는 데 힘을 쏟은 오스트리아학파 경제학자인 루트비히 폰 미제스의 사상에 깊이 공감하고 있고, 자유시장경제와 형사 법집행 문제에 관해 고민해 왔다”며 “시장경제와 가격기구, 자유로운 기업 활동이 인류의 번영과 행복을 증진해 왔고, 이는 역사적으로도 증명된 사실이라는 강한 믿음을 가지고 있다”고 설명했다.","{'word': '밀턴 프리드먼', 'start_idx': 104, 'end_idx': 110, 'entity_type': 'PER'}","{'word': '시카고학파', 'start_idx': 97, 'end_idx': 101, 'entity_type': 'ORG'}",per:employee_of,정준녕,"('밀턴 프리드먼', '시카고학파')",per:employee_of,3
46,박정희_58,1998년 2월 12일 처음 게제됐었던 조갑제의 조선일보 인터뷰 기사에 의하면 유증선씨는 1938년 5월쯤에 박정희가 핏방울로 시험지에다 '盡忠報國 滅私奉公(진충보국 멸사봉공)'이라고 써서 만주로 보냈다고 한다.,"{'word': '조갑제', 'start_idx': 22, 'end_idx': 24, 'entity_type': 'PER'}","{'word': '조선일보', 'start_idx': 27, 'end_idx': 30, 'entity_type': 'ORG'}",no_relation,이정아,"('조갑제', '조선일보')",per:employee_of,3
47,이승만3_72,1945년 10월 23일 각 정당·단체 대표 200여 명이 모여 이승만을 정점으로 소집한 회합에서 독립촉성중앙협의회의 회장으로 추대되었다.,"{'word': '이승만', 'start_idx': 36, 'end_idx': 38, 'entity_type': 'PER'}","{'word': '독립촉성중앙협의회의 회장', 'start_idx': 55, 'end_idx': 67, 'entity_type': 'POH'}",per:title,정준녕,"('이승만', '독립촉성중앙협의회의 회장')",per:title,5
48,문재인_25,"이후 2015년 2월 8일 새정치민주연합 제1차 전당대회에서 41.8%를 얻은 박지원 후보를 앞선 45.3%를 얻으며 새정치민주연합 당대표에 당선되었으며, 새정치민주연합이 더불어민주당으로 개편된 후에도 계속 대표를 지냈다.","{'word': '박지원', 'start_idx': 44, 'end_idx': 46, 'entity_type': 'PER'}","{'word': '새정치민주연합', 'start_idx': 66, 'end_idx': 72, 'entity_type': 'ORG'}",per:employee_of,이원재,"('박지원', '새정치민주연합')",per:employee_of,3
49,문재인_49,문용형은 거제에 정착한 후 공무원 경력을 제시하며 거제도 포로수용소의 노무자로 일자리를 얻었고 그의 부인은 계란 행상을 했다.,"{'word': '문용형', 'start_idx': 0, 'end_idx': 2, 'entity_type': 'PER'}","{'word': '노무자', 'start_idx': 39, 'end_idx': 41, 'entity_type': 'POH'}",per:title,이원재,"('문용형', '노무자')",per:title,5
